,name,product_url,rating,review_count,price,product_type
1209,"Tomer-wharf Ergonomic Silicone Gel Wrist Support Mouse Pad,Clear Wristband Pad for Desktop Computer,Heart-Shaped Translucence Cool Hand Pillow Cushion,Effectively Reduce Wrist Fatigue and Pain.Violet",https://www.amazon.com/Tomer-wharf-Heart-Shaped-Translucence-Effectively-Pain-Violet/dp/B07JNL2YFM/ref=sr_1_1458?dchild=1&keywords=mouse&qid=1594378041&s=computers-intl-ship&sr=1-1458,4.3 out of 5 stars,81,$7.98,Mouse
1210,"OTM Essentials Black Mouse Pad, Flamingo",https://www.amazon.com/OTM-Essentials-Black-Mouse-Flamingo/dp/B01BYKE6PE/ref=sr_1_1459?dchild=1&keywords=mouse&qid=1594378041&s=computers-intl-ship&sr=1-1459,4.7 out of 5 stars,14,$12.21,Mouse
1211,"Large Gaming Mouse Pad (36×16 inch), Non-Slip Rubber Base, Stitched Edges, Professional High-Performance Extended Mousepad Mouse Mat, 2 Designs Available by GamingEagle - Eagle Design",https://www.amazon.com/Gaming-Professional-High-Performance-Available-GamingEagle/dp/B07JZ29ZDN/ref=sr_1_1460?dchild=1&keywords=mouse&qid=1594378041&s=computers-intl-ship&sr=1-1460,4.6 out of 5 stars,21,$15.99,Mouse
1212,"WIWU Tablet Sleeve Bag for 10.5 iPad Air / 10.5 iPad Pro, 10.2 New iPad 2019, Double Layers Business Organizer Bag for Tablet,Phone,Mouse and More Electronic Accessories",https://www.amazon.com/WIWU-Business-Organizer-Electronic-Accessories/dp/B085C2388X/ref=sr_1_1470?dchild=1&keywords=mouse&qid=1594378041&s=computers-intl-ship&sr=1-1470,4.6 out of 5 stars,36,$25.99,Mouse
1213,WeChip Air Remote Mouse 2.4G Smart TV Wireless Remote Control Wireless Keyboard for Android TV Box/PC/Smart TV/Projector/All-in-one PC (WeChip W1),https://www.amazon.com/Keyboard-WeChip-Wireless-Handheld-Controller/dp/B07HB248H6/ref=sr_1_1478?dchild=1&keywords=mouse&qid=1594378041&s=computers-intl-ship&sr=1-1478,3.6 out of 5 stars,105,$18.99,Mouse
1214,Star Wars Round mosue pad Gaming Mouse pad Non-Slip Mouse pad,https://www.amazon.com/Round-mosue-pad-Gaming-Non-Slip/dp/B088THDS7B/ref=sr_1_1479?dchild=1&keywords=mouse&qid=1594378041&s=computers-intl-ship&sr=1-1479,,,$7.99,Mouse
1215,"Mini Wireless Keyboard,Rii F8 Wireless 2.4G Keyboard with Touchpad Mouse Combo,IR Learning,Backlit Keyboard Controller for PC,Android TV Box,Linux,Windows",https://www.amazon.com/Wireless-Keyboard-Rii-Touchpad-Controller/dp/B08735C6X5/ref=sr_1_1480?dchild=1&keywords=mouse&qid=1594378041&s=computers-intl-ship&sr=1-1480,5.0 out of 5 stars,61,$16.99,Mouse
1216,"Gaming Mouse Pad,Round Mousepad with Non-Slip Rubber Base for Laptop Computer Desktop,Pretty Paw Prints Game Mouse mat",https://www.amazon.com/Gaming-Mousepad-Non-Slip-Computer-Desktop/dp/B07YTZZBD6/ref=sr_1_1481?dchild=1&keywords=mouse&qid=1594378041&s=computers-intl-ship&sr=1-1481,5.0 out of 5 stars,2,$6.99,Mouse
1217,Nicokee Sharks Gaming Mousepad Under Sea Fish Sharks Mouse Pad Rectangle Mouse Mat for Computer Desk Laptop Office 9.5 X 7.9 Inch Non-Slip Rubber,https://www.amazon.com/Nicokee-Mousepad-Rectangle-Computer-Non-Slip/dp/B07S3ZJBJ4/ref=sr_1_1482?dchild=1&keywords=mouse&qid=1594378041&s=computers-intl-ship&sr=1-1482,4.8 out of 5 stars,15,$8.99,Mouse
1218,12 x 10 inches Cute Poke-Monster Anime Comic Gaming Mouse Pad Custom Stitched Mousepad mat,https://www.amazon.com/inches-Poke-Monster-Gaming-Stitched-Mousepad/dp/B07KVDGHYV/ref=sr_1_1485?dchild=1&keywords=mouse&qid=1594378041&s=computers-intl-ship&sr=1-1485,5.0 out of 5 stars,13,$7.99,Mouse
1219,Funy Cute Cat Like a DJ Pizza Galaxy Space Gaming Mouse Pad,https://www.amazon.com/Pizza-Galaxy-Space-Gaming-Mouse/dp/B07R28KKBF/ref=sr_1_1486?dchild=1&keywords=mouse&qid=1594378041&s=computers-intl-ship&sr=1-1486,4.9 out of 5 stars,7,$6.99,Mouse
1220,Premium Adjustable Computer Wrist Rest Armrest - Desk and Chair Dual Purpose Attachable Home&Office Computer Arm Support - Ergonomically Designed Mouse Pad Arm-stand Desk Extender (Black),https://www.amazon.com/Premium-Adjustable-Computer-Wrist-Armrest/dp/B010UKQ5QM/ref=sr_1_1487?dchild=1&keywords=mouse&qid=1594378041&s=computers-intl-ship&sr=1-1487,3.6 out of 5 stars,240,$29.99,Mouse
1221,Smooffly Soccer Large Mousepad Mouse Pad Great Gift Idea,https://www.amazon.com/Smooffly-Soccer-Large-Mousepad-Mouse/dp/B01N310C10/ref=sr_1_1488?dchild=1&keywords=mouse&qid=1594378041&s=computers-intl-ship&sr=1-1488,5.0 out of 5 stars,8,$7.89,Mouse
1222,Westlake Art - Starry Night Castle Night Boats - Mouse Pad - Non-Slip Rubber Abstract Artwork Home Office Computer Laptop PC Mac Mousepad 8x9 Inch (36D4F) (8x9 Inch),https://www.amazon.com/Westlake-Art-Non-Slip-Abstract-Computer/dp/B07GDF5D63/ref=sr_1_1489?dchild=1&keywords=mouse&qid=1594378041&s=computers-intl-ship&sr=1-1489,4.7 out of 5 stars,5,$7.88,Mouse
1223,"Clear Desk Office Blotter Pad Writing Mats Table Protector on Top of Desks for Office Laptop Computer Desktop Non-Slip Textured Round Edges Design, Mousepad Included Wipeable Waterproof 17 X 36 Inch",https://www.amazon.com/Protector-Computer-Non-Slip-Textured-Waterproof/dp/B07YVJ4HQ2/ref=sr_1_1490?dchild=1&keywords=mouse&qid=1594378041&s=computers-intl-ship&sr=1-1490,4.3 out of 5 stars,167,$17.99,Mouse
1224,"Bluetooth Mouse, Dual Mode (Bluetooth 4.0 + USB) 2.4GHz Wireless Bluetooth Mouse, Dual Mode Slim Rechargeable Wireless Mouse Silent USB Mice，Suitable for Laptop, MacBook, PC (Silver)",https://www.amazon.com/dp/B0832TTZG4/ref=sr_1_1491?dchild=1&keywords=mouse&qid=1594378041&s=computers-intl-ship&sr=1-1491,5.0 out of 5 stars,2,$15.99,Mouse
1225,Harris Guitar Shaped Mouse Pad (MPAD-ST),https://www.amazon.com/Harris-Guitar-Shaped-Mouse-MPAD-ST/dp/B000FNB8NA/ref=sr_1_1492?dchild=1&keywords=mouse&qid=1594378041&s=computers-intl-ship&sr=1-1492,4.6 out of 5 stars,14,$11.96,Mouse
1226,"Designer Desk Mouse Pad, Cute Mouse Pad for Women, Office, Work & Home Computer Accessory, Beautiful & Vibrant Floral Design, Non Slip, Circular Flower (Multi-Color, Round)",https://www.amazon.com/Designer-Desk-Accessory-Beautiful-Multi-Color/dp/B07YSY2DVY/ref=sr_1_1491?dchild=1&keywords=mouse&qid=1594378041&s=computers-intl-ship&sr=1-1491,5.0 out of 5 stars,17,$9.99,Mouse
1227,ValueRays Heated Mouse Quiet Click Heated Buttons Universal Size (Solid Black),https://www.amazon.com/ValueRays-Heated-Mouse-Quiet-Buttons/dp/B07QB4VJJ2/ref=sr_1_1492?dchild=1&keywords=mouse&qid=1594378041&s=computers-intl-ship&sr=1-1492,4.2 out of 5 stars,15,$19.95,Mouse
1228,"SANWA 2.4G Wireless Ergonomic Mouse, Optical Vertical Mice, for Small Hands, Reduce Wrist Strain, (800/1200/1600 Adjustable DPI, 6 Buttons) Compatible with MacBook, Laptop, Windows, Mac OS, GMAERGW17",https://www.amazon.com/SANWA-Wireless-Vertical-Ergonomic-Receiver/dp/B07JLFF3VJ/ref=sr_1_1493?dchild=1&keywords=mouse&qid=1594378041&s=computers-intl-ship&sr=1-1493,4.3 out of 5 stars,13,$17.99,Mouse
1229,"X-Files Mouse Pad - I Want to Believe - 10"" x 8.5"" Standard Size",https://www.amazon.com/X-Files-Mouse-Pad-Believe-Standard/dp/B07N7YPC2Y/ref=sr_1_1494?dchild=1&keywords=mouse&qid=1594378041&s=computers-intl-ship&sr=1-1494,5.0 out of 5 stars,11,$10.95,Mouse
1230,Cmhoo Gaming Mouse Pad Extended & Desk Mat Large Protector Stickers 35.4 x 15.7 (90x40 yinhe),https://www.amazon.com/Cmhoo-Extended-Protector-Stickers-90x40/dp/B06XXCWJ33/ref=sr_1_1495?dchild=1&keywords=mouse&qid=1594378041&s=computers-intl-ship&sr=1-1495,4.8 out of 5 stars,252,$17.99,Mouse
1231,Cowboy Bebop Large Mouse Pad XXL Extended Mat Desk Pad Mousepad Long Non-Slip Rubber Mice Pads,https://www.amazon.com/Cowboy-Extended-Mousepad-Non-Slip-Rubber/dp/B07PX4FYGJ/ref=sr_1_1496?dchild=1&keywords=mouse&qid=1594378041&s=computers-intl-ship&sr=1-1496,4.7 out of 5 stars,7,$25.00,Mouse
1232,RollerMouse Red - Ultimate Ergonomic Mouse,https://www.amazon.com/RollerMouse-Red-Ultimate-Ergonomic-Mouse/dp/B00DE83RSC/ref=sr_1_1497?dchild=1&keywords=mouse&qid=1594378041&s=computers-intl-ship&sr=1-1497,4.4 out of 5 stars,145,,Mouse
1233,Logitech M187 Wireless Mini Mouse,https://www.amazon.com/Logitech-M187-Wireless-Mini-Mouse/dp/B008RN04BM/ref=sr_1_1498?dchild=1&keywords=mouse&qid=1594378041&s=computers-intl-ship&sr=1-1498,4.5 out of 5 stars,180,,Mouse
1234,"Smooffly Watercolor Flower Mouse Pads, Flowers in Soft Colors and Floral Design Blurred Style, Navy Red Orange Best Gaming Mouse pad",https://www.amazon.com/Smooffly-Watercolor-Flower-Flowers-Blurred/dp/B07CGSTPGJ/ref=sr_1_1501?dchild=1&keywords=mouse&qid=1594378041&s=computers-intl-ship&sr=1-1501,4.4 out of 5 stars,15,$7.89,Mouse
1235,"MOSISO Gel Keyboard Wrist Rest Pad & Foam Cushion Wrist Rests Mouse Pad Support Set Ergonomic Mousepad Non-Slip Rubber Base Easy Typing Cushion with Neoprene Cloth for Laptop/Notebook/Desktop, Black",https://www.amazon.com/MOSISO-Keyboard-Ergonomic-Mousepad-Non-Slip/dp/B087BVZD9H/ref=sr_1_1502?dchild=1&keywords=mouse&qid=1594378041&s=computers-intl-ship&sr=1-1502,5.0 out of 5 stars,1,$16.99,Mouse
1236,"MoKo Slim Keyboard and Mouse Set, Ultra-Thin 2.4G Light Full-Size Wireless Keyboard & Mouse Combo with Nano USB Receiver for Android, Windows, Laptop, Desktop, PC, Notebook, Computer - Black",https://www.amazon.com/MoKo-Keyboard-Ultra-thin-Full-Size-Wireless/dp/B07DPKPVSN/ref=sr_1_1503?dchild=1&keywords=mouse&qid=1594378041&s=computers-intl-ship&sr=1-1503,3.7 out of 5 stars,23,$29.99,Mouse
1237,Keyboard Wrist Rest Pad and Mouse Wrist Rest Support Mouse Pad Pads for Computers Memory Foam Nonslip Lightweight Cute Personalized Mousepad Mat for Office Gaming Computer Laptop (MKP-C1),https://www.amazon.com/Keyboard-Computers-Lightweight-Personalized-Mousepad/dp/B07YTW2C82/ref=sr_1_1504?dchild=1&keywords=mouse&qid=1594378041&s=computers-intl-ship&sr=1-1504,4.7 out of 5 stars,32,$17.99,Mouse
1238,"Smooffly Inspirational Christian Bible Verse Proberbs Quotes Mouse Pad, She Opens Her Mouth with Wisdom and The Teaching of Kindness is on Her Tongue Mouse pad 9.5""X7.9""Inch",https://www.amazon.com/Smooffly-Inspirational-Christian-Proberbs-Teaching/dp/B078ZCDJS8/ref=sr_1_1505?dchild=1&keywords=mouse&qid=1594378041&s=computers-intl-ship&sr=1-1505,4.5 out of 5 stars,23,$7.89,Mouse
1239,"Swingline Mouse Pad, Acrylic, Stratus, Clear (S7010140)",https://www.amazon.com/Swingline-Mouse-Stratus-Acrylic-S7010140/dp/B00OIM5O9S/ref=sr_1_1506?dchild=1&keywords=mouse&qid=1594378041&s=computers-intl-ship&sr=1-1506,4.7 out of 5 stars,340,$14.89,Mouse
1240,iHome by Lifeworks Technology IH-M391C Comfort - Wireless Optical Mouse (Grey),https://www.amazon.com/iHome-Lifeworks-Technology-IH-M391C-Comfort/dp/B00X8FKW52/ref=sr_1_1507?dchild=1&keywords=mouse&qid=1594378041&s=computers-intl-ship&sr=1-1507,3.7 out of 5 stars,11,$11.46,Mouse
1241,"Logitech G Powerplay Wireless Charging System for G502 Lightspeed, G703, G903 Lightspeed and PRO Wireless Gaming Mice, Cloth or Hard Gaming Mouse Pad - Black",https://www.amazon.com/Logitech-Powerplay-Wireless-Charging-Lightspeed/dp/B071WZ56G9/ref=sr_1_1508?dchild=1&keywords=mouse&qid=1594378041&s=computers-intl-ship&sr=1-1508,4.5 out of 5 stars,565,,Mouse
1242,"Mouse Pad with Wrist Support, Ergonomic Mouse Pad Wrist Rest Memory Foam Gaming Mouse Pads Pain Relief Mousepad Lightweight Non-Slip Wrist Cushion Rubber Base for Computer Home Office (Sunflower)",https://www.amazon.com/Ergonomic-Mousepad-Lightweight-Non-Slip-Sunflower/dp/B085RJZZZT/ref=sr_1_1507?dchild=1&keywords=mouse&qid=1594378041&s=computers-intl-ship&sr=1-1507,,,$11.98,Mouse
1243,"Ambesonne Italy Mouse Pad, Scenic View of Positano Amalfi Naples Blooming Flowers Coastal Village Image, Rectangle Non-Slip Rubber Mousepad, Standard Size, Pink Green Blue",https://www.amazon.com/Ambesonne-Positano-Blooming-Standard-Rectangle/dp/B07BHMKZKN/ref=sr_1_1508?dchild=1&keywords=mouse&qid=1594378041&s=computers-intl-ship&sr=1-1508,4.2 out of 5 stars,37,$7.95,Mouse
1244,"NACODEX AJ52 Gaming Mouse Wired, Programmable 7 Buttons, Computer Mice with Crack Pattern LED Backlit, 2500 DPI Adjustable for Laptop PC Computer Games Or Work (Star White)",https://www.amazon.com/NACODEX-AJ52-Programmable-Computer-Adjustable/dp/B081T1XVBQ/ref=sr_1_1509?dchild=1&keywords=mouse&qid=1594378041&s=computers-intl-ship&sr=1-1509,4.6 out of 5 stars,3,$16.99,Mouse
1245,"Monoy Office Desk Pad,Home Desk Mat - Dual Sided Waterproof PU Leather - Extended Mouse Pad for Gaming - Smooth Writing Blotter - Desk Decor Non-Slip Spill-Resistant (Light Green-Flamingo)",https://www.amazon.com/Monoy-Office-Desk-Home-Spill-Resistant/dp/B07XJ25LNK/ref=sr_1_1510?dchild=1&keywords=mouse&qid=1594378041&s=computers-intl-ship&sr=1-1510,4.8 out of 5 stars,43,$15.99,Mouse
1246,SYMSPAD Jurassic Park Mousepad 8.6 X 7.1 in,https://www.amazon.com/SYMSPAD-Jurassic-Park-Mousepad-8-6/dp/B07SQVL52K/ref=sr_1_1511?dchild=1&keywords=mouse&qid=1594378041&s=computers-intl-ship&sr=1-1511,4.1 out of 5 stars,7,$10.99,Mouse
1247,"Teenage Mutant Ninja Turtles TMNT Eating Pizza Gaming Mouse Pad,Rectangle Mouse Pad",https://www.amazon.com/Teenage-Turtles-Mouse-Pad-Rectangle/dp/B00UMZOCF2/ref=sr_1_1512?dchild=1&keywords=mouse&qid=1594378041&s=computers-intl-ship&sr=1-1512,4.6 out of 5 stars,29,$10.00,Mouse
1248,Evoluent VM4SW VerticalMouse 4 Right Hand Ergonomic Mouse with Wireless Connection (Small Size),https://www.amazon.com/Evoluent-VM4SW-VerticalMouse-Ergonomic-Connection/dp/B00EZCCVTM/ref=sr_1_1513?dchild=1&keywords=mouse&qid=1594378041&s=computers-intl-ship&sr=1-1513,4.1 out of 5 stars,392,,Mouse
1249,"6 Button Wired Mouse,Ergonomic USB Computer Mouse with 4 Adjustable DPI,Rainbow LED Light,PC Gaming Mouse,for Desktop Computers,Laptops, Gaming Mouse Compatible with Windows Mac OS Linux,Black",https://www.amazon.com/Ergonomic-Computer-Adjustable-Computers-Compatible/dp/B07T7NBXJ4/ref=sr_1_1514?dchild=1&keywords=mouse&qid=1594378041&s=computers-intl-ship&sr=1-1514,3.9 out of 5 stars,17,$14.80,Mouse
1250,Verbatim Bluetooth Multi-Trac LED Tablet Mouse,https://www.amazon.com/Verbatim-Bluetooth-Wireless-Multi-Trac-98590/dp/B014MICAP8/ref=sr_1_1517?dchild=1&keywords=mouse&qid=1594378041&s=computers-intl-ship&sr=1-1517,3.7 out of 5 stars,44,$13.95,Mouse
1251,"ITNRSIIET Upgraded Ergonomic Keyboard Wrist Rest and Mouse Wrist Rest Pad Set, Cute Cactus Wrist Pad with Non-Slip Base for Computer, Laptop, Gaming, Working, Easy Typing & Pain Relief",https://www.amazon.com/ITNRSIIET-Upgraded-Ergonomic-Cute-Cactus/dp/B085HCL9PQ/ref=sr_1_1518?dchild=1&keywords=mouse&qid=1594378041&s=computers-intl-ship&sr=1-1518,4.6 out of 5 stars,34,$17.98,Mouse
1252,"Jiale 2 Pack Professional LED Optical 7200 DPI 7 Button USB Wired Gaming Mouse Mice for Gamer, PC, MAC, Laptop, Computer-Black",https://www.amazon.com/Jiale-Professional-Optical-Button-Computer-Black/dp/B01EL7KX6S/ref=sr_1_1520?dchild=1&keywords=mouse&qid=1594378041&s=computers-intl-ship&sr=1-1520,4.3 out of 5 stars,70,$19.99,Mouse
1253,Plutus Luxury Soccer Gift 2.4G Wireless Mouse USB Receiver Optical Mouse National Flags Support Your Country PC Laptop Computer Very Durable,https://www.amazon.com/Plutus-Luxury-Argentina-Wireless-Argentinian/dp/B078YBWQ1R/ref=sr_1_1529?dchild=1&keywords=mouse&qid=1594378041&s=computers-intl-ship&sr=1-1529,4.1 out of 5 stars,6,$15.00,Mouse
1254,"Wireless Keyboard and Mouse Combo, 2.4G Cute Round Mute Keyboard Mouse Set for Laptop, Computer, Mac(Red Black)",https://www.amazon.com/Wireless-Keyboard-Mouse-Laptop-Computer/dp/B07T59BX8N/ref=sr_1_1538?dchild=1&keywords=mouse&qid=1594378041&s=computers-intl-ship&sr=1-1538,4.2 out of 5 stars,60,$29.99,Mouse
1255,"Gaming Mouse, Lychee USB Wired Optical Gaming Mice, 4000 DPI Professional 12 Buttons Programmable Gamer Mouse with RGB Backlit, Adjustable 2.4G Acceleration for Laptop/ PC/ Computer",https://www.amazon.com/Professional-Programmable-Adjustable-Acceleration-Computer-Windows/dp/B07CB8THC8/ref=sr_1_1539?dchild=1&keywords=mouse&qid=1594378041&s=computers-intl-ship&sr=1-1539,4.0 out of 5 stars,26,$25.99,Mouse
1256,"Fellowes Gel Wrist Rest and Mouse Rest, Sapphire/Black (98741)",https://www.amazon.com/Fellowes-Wrist-Mouse-Sapphire-98741/dp/B00004Z639/ref=sr_1_1540?dchild=1&keywords=mouse&qid=1594378041&s=computers-intl-ship&sr=1-1540,4.4 out of 5 stars,137,$17.99,Mouse
1257,2020 Calendar Mouse pad Gaming Mouse pad Office Mousepad Nonslip Rubber Backing-Black,https://www.amazon.com/Calendar-Gaming-Mousepad-Nonslip-Backing-Black/dp/B07YW6Q7WJ/ref=sr_1_1539?dchild=1&keywords=mouse&qid=1594378041&s=computers-intl-ship&sr=1-1539,4.8 out of 5 stars,29,$4.59,Mouse
1258,Logitech M187 Wireless Mini Mouse - Blue,https://www.amazon.com/Logitech-M187-Wireless-Mini-Mouse/dp/B00745IE3E/ref=sr_1_1540?dchild=1&keywords=mouse&qid=1594378041&s=computers-intl-ship&sr=1-1540,4.4 out of 5 stars,278,$24.99,Mouse
1259,"Smooffly Gaming Mouse Pad Custom,Bible Verses Christian Quotes i Will Walk by Faith Even When i Cannot See 1 Corinthians 5:7 Non-Slip Rubber Large Mouse pad",https://www.amazon.com/Smooffly-Gaming-Custom-Christian-Corinthians/dp/B078ZC3VL2/ref=sr_1_1541?dchild=1&keywords=mouse&qid=1594378041&s=computers-intl-ship&sr=1-1541,5.0 out of 5 stars,10,$7.89,Mouse
1260,Ergonomic Mouse Pad with Gel Wrist Rest Support Marble Pattern Mousepad Non-Slip Base Durable Ergonomic Gaming Mouse Pads for Office and Home (Pink Marble),https://www.amazon.com/Ergonomic-Support-Pattern-Mousepad-Non-Slip/dp/B07N5F8XSX/ref=sr_1_1542?dchild=1&keywords=mouse&qid=1594378041&s=computers-intl-ship&sr=1-1542,4.6 out of 5 stars,60,$10.88,Mouse
1261,"Gaming Mouse Pad Starry Blue Mandala Pattern Mousepad Computer Laptop Non-Slip Rubber Base Mouse Mat with Stitched Edge for Office & Home,9.8×11.8inches",https://www.amazon.com/Mousepad-Computer-Non-Slip-Stitched-9-8%C3%9711-8inches/dp/B07TGBSVYR/ref=sr_1_1543?dchild=1&keywords=mouse&qid=1594378041&s=computers-intl-ship&sr=1-1543,4.9 out of 5 stars,10,$8.99,Mouse
1262,Smooffly Funny Doge Mousepad Rectangle Shape,https://www.amazon.com/Smooffly-Funny-Mousepad-Rectangle-Shape/dp/B01N6NVDKH/ref=sr_1_1544?dchild=1&keywords=mouse&qid=1594378041&s=computers-intl-ship&sr=1-1544,4.7 out of 5 stars,77,$7.89,Mouse
1263,"Dooke Keyboard Wrist Rest Pad and Mouse Wrist Rest Support, Comfort Wrist Rest Pad with Non-Slip Rubber Base & Memory Foam Support for Working Gaming Fatigue Pain Relief Cactus",https://www.amazon.com/Dooke-Keyboard-Support-Comfort-Non-Slip/dp/B085ZGL2LG/ref=sr_1_1545?dchild=1&keywords=mouse&qid=1594378041&s=computers-intl-ship&sr=1-1545,5.0 out of 5 stars,1,$18.99,Mouse
1264,"SA@ Luxury 6 Colors Bling Crystal Rhinestone 2.4G Wireless Mouse for Laptop, Notebook, PC, Computer, MacBook Gifts for The Office (Black)",https://www.amazon.com/SA-Wireless-Rhinestone-Receiver-Notebook/dp/B07KBYN7ZL/ref=sr_1_1546?dchild=1&keywords=mouse&qid=1594378041&s=computers-intl-ship&sr=1-1546,4.1 out of 5 stars,26,$22.98,Mouse
1265,"Large Gaming Mouse Pad, Imegny Extended XXL Desk Pad & Non-Slip Rubber Keyboard Mat Stitched Edges-(gaota007)",https://www.amazon.com/Imegny-Extended-Non-Slip-Keyboard-Stitched/dp/B07NVFZPTT/ref=sr_1_1549?dchild=1&keywords=mouse&qid=1594378041&s=computers-intl-ship&sr=1-1549,4.7 out of 5 stars,23,$20.99,Mouse
1266,Ergonomic Handheld Trackball Mouse Wired Mini USB Portable Finger Travel Computer Right Left Handed Mice for PC Laptop Mac Window OS Linux Unix,https://www.amazon.com/Ergonomic-Handheld-Trackball-Portable-Computer/dp/B071NT761Z/ref=sr_1_1550?dchild=1&keywords=mouse&qid=1594378041&s=computers-intl-ship&sr=1-1550,3.5 out of 5 stars,101,$17.99,Mouse
1267,"SANWA (Japan Brand) Gel Wrist Rest for Keyboard & Mouse, Non-Slip, Comfortable Gaming Wrist Pillow, PU Leather Wrist Cushion Support for Office, Computer, Laptop, MacBook, Gaming, (11.2×2.7×0.74 inch)",https://www.amazon.com/SANWA-Keyboard-Non-Slip-Comfortable-300%C3%9770%C3%9719mm/dp/B07RPVG1PD/ref=sr_1_1551?dchild=1&keywords=mouse&qid=1594378041&s=computers-intl-ship&sr=1-1551,4.5 out of 5 stars,85,$18.99,Mouse
1268,"Mouse Pad with Wrist Support, McoMce Ergonomic Mouse Pad with Gel Wrist Rest Support, Pain Relief Gaming Mousepad with Lycra Cloth, Non-Slip Rubber Base for Office, Home Laptop Computer",https://www.amazon.com/Support-Ergonomic-Mousepad-Non-Slip-Computer/dp/B07YY1QC47/ref=sr_1_1552?dchild=1&keywords=mouse&qid=1594378041&s=computers-intl-ship&sr=1-1552,4.1 out of 5 stars,64,$6.09,Mouse
1269,"Bluetooth & 2.4G Slim Wireless Mouse, 3 Adjustable DPI,Less Noise, Portable Dual Mode Rechargeable Wireless Mouse for PC,Computer,Laptop, MacBook (Grey)",https://www.amazon.com/Bluetooth-Wireless-Adjustable-Portable-Rechargeable/dp/B07XCY28WW/ref=sr_1_1553?dchild=1&keywords=mouse&qid=1594378041&s=computers-intl-ship&sr=1-1553,3.9 out of 5 stars,13,$13.99,Mouse
1270,"Extended Gaming Mouse Pad - 30.71 x 13.78 in, All DPI Setting, No Logo, Anti-fray Stitched Edges, Non-Slip Rubber Base, Micro-Woven Surface. Large Mouse Pad, Keyboard Mat (Black) by Green2B",https://www.amazon.com/Extended-Gaming-Mouse-Pad-Micro-Woven/dp/B0829H29WM/ref=sr_1_1554?dchild=1&keywords=mouse&qid=1594378041&s=computers-intl-ship&sr=1-1554,5.0 out of 5 stars,8,$15.95,Mouse
1271,"Lenovo Yoga Mouse with Laser Presenter, 2.4GHz Wireless Nano Receiver & Bluetooth 5.0, Award-Winning Ergonomic V-Shape, Adjustable 1600 DPI, Optical Mouse, GY50U59626, Iron Grey",https://www.amazon.com/Lenovo-Yoga-Mouse-Laser-Presenter/dp/B07WVLCC84/ref=sr_1_1555?dchild=1&keywords=mouse&qid=1594378041&s=computers-intl-ship&sr=1-1555,4.1 out of 5 stars,11,$59.99,Mouse
1272,Omega Psi Phi Waterproof Office Mouse Pad Round Mouse Mat 7.9 Diameter Inch 1 PCS,https://www.amazon.com/Omega-Waterproof-Office-Mouse-Diameter/dp/B07ZPP1VK6/ref=sr_1_1556?dchild=1&keywords=mouse&qid=1594378041&s=computers-intl-ship&sr=1-1556,,,$9.99,Mouse
1273,"Wireless Mouse Rechargeable, TedGem 2.4G Silent Ergonomic Computer Mouse USB Mouse Laptop Full Size Optical Mouse with USB Receiver 6 Buttons 5 DPI Adjustable Portable Mice for Laptop/PC/Windows/Mac",https://www.amazon.com/Wireless-Rechargeable-TedGem-Ergonomic-Adjustable/dp/B07RN5G7KX/ref=sr_1_1555?dchild=1&keywords=mouse&qid=1594378041&s=computers-intl-ship&sr=1-1555,3.5 out of 5 stars,147,$11.99,Mouse
1274,"Passion Sparks Dream, Life Needs Sports,Stay Positive Work Hard and Make It Happen Personalized Unique Design Non-Slip Rubber Yellow Black Gaming Mouse Pad",https://www.amazon.com/Passion-Sparks-Positive-Personalized-Non-Slip/dp/B07XL9Y7BQ/ref=sr_1_1556?dchild=1&keywords=mouse&qid=1594378041&s=computers-intl-ship&sr=1-1556,3.5 out of 5 stars,2,$10.99,Mouse
1275,Usbkingdom 2.4GHz Wireless Mouse Cool 3D Sport Car Shape Ergonomic Optical Mice with USB Receiver for PC Laptop Computer Women Small Hands (Blue),https://www.amazon.com/Usbkingdom-Wireless-Ergonomic-Receiver-Computer/dp/B01LH3QZ4S/ref=sr_1_1557?dchild=1&keywords=mouse&qid=1594378041&s=computers-intl-ship&sr=1-1557,4.4 out of 5 stars,258,$12.99,Mouse
1276,"Memory Foam Mousepad with Wrist Support, Funy Cool Rambo Cat Unique Design Ergonomic Mouse Pad Wrist Rest, Super Non-Slip PU Base",https://www.amazon.com/Memory-Mousepad-Support-Ergonomic-Non-Slip/dp/B07BKX2S7X/ref=sr_1_1558?dchild=1&keywords=mouse&qid=1594378041&s=computers-intl-ship&sr=1-1558,4.7 out of 5 stars,68,$12.99,Mouse
1277,Snpurdiri Ergonomic Vertical Mouse Rechargeable Wireless Gaming Mouse with RGB Lighting 7 Buttons Side Scrolling and Full-Size 4 Adjustable DPI 800/1600/2400/4800 Computer Mouse for Laptop PC MacBook,https://www.amazon.com/Snpurdiri-Ergonomic-Rechargeable-Scrolling-Adjustable/dp/B088FGMFNV/ref=sr_1_1559?dchild=1&keywords=mouse&qid=1594378041&s=computers-intl-ship&sr=1-1559,5.0 out of 5 stars,2,$22.99,Mouse
1278,Logitech USB Unifying Receiver,https://www.amazon.com/Logitech-910-005235-USB-Unifying-Receiver/dp/B072JW9LT8/ref=sr_1_1560?dchild=1&keywords=mouse&qid=1594378041&s=computers-intl-ship&sr=1-1560,4.2 out of 5 stars,"1,818",$11.95,Mouse
1279,"[Premium Version] SADES Gaming Mouse Wired -Scythe- 7 Programmable Buttons, 11 RGB Lighting, 4000 DPI Adjustable, Comfortable Grip Ergonomic Optical PC Computer Gaming Mice with Sniper Button",https://www.amazon.com/SADES-Programmable-Adjustable-Comfortable-Ergonomic/dp/B07TB269PT/ref=sr_1_1561?dchild=1&keywords=mouse&qid=1594378041&s=computers-intl-ship&sr=1-1561,4.5 out of 5 stars,19,$28.99,Mouse
1280,G10s Pro Voice Air Remote Mouse with Backlight 2.4GHz Mini Fly Mouse with Voice Input for Android Shield TV Box,https://www.amazon.com/Remote-Backlight-2-4GHz-Android-Shield/dp/B0834BPLP2/ref=sr_1_1565?dchild=1&keywords=mouse&qid=1594378041&s=computers-intl-ship&sr=1-1565,4.7 out of 5 stars,8,$11.99,Mouse
1281,Allsop ASP26226 Wrist Aid Ergonomic Circular Mouse Pad,https://www.amazon.com/ASP26226-Allsop-Wrist-Ergonomic-Circular/dp/B0035NHU4S/ref=sr_1_1566?dchild=1&keywords=mouse&qid=1594378041&s=computers-intl-ship&sr=1-1566,4.4 out of 5 stars,25,$13.80,Mouse
1282,Mouse Pad Pink Roses 36230 Oblong Shaped Mouse Mat Design Natural Eco Rubber Durable Computer Desk Stationery Accessories Mouse Pads for Gift,https://www.amazon.com/Natural-Durable-Computer-Stationery-Accessories/dp/B00UBN6VNG/ref=sr_1_1567?dchild=1&keywords=mouse&qid=1594378041&s=computers-intl-ship&sr=1-1567,4.5 out of 5 stars,667,$6.99,Mouse
1283,"Bluetooth and 2.4GHz Rechargeable Wireless Mouse, Dual Mode Slim Mute Silent Click Noiseless Optical Mouse with USB Receiver Compatible with MacBook, Notebook, PC, Laptop, Desktop, Computer",https://www.amazon.com/Bluetooth-Rechargeable-Wireless-Noiseless-Compatible/dp/B07YD3YKTP/ref=sr_1_1568?dchild=1&keywords=mouse&qid=1594378041&s=computers-intl-ship&sr=1-1568,3.8 out of 5 stars,14,$15.49,Mouse
1284,"Memory Foam Ergonomic Designed Mouse Pad with Wrist Support,Knocent Wrist Mouse Pads, Non-Slip Rubber Round Mousepads and Pain Relief Mouse Mat, Great for Gaming & Work (MF Teal Marble)",https://www.amazon.com/Ergonomic-Designed-Knocent-Non-Slip-Mousepads/dp/B07PJGY6Z4/ref=sr_1_1570?dchild=1&keywords=mouse&qid=1594378041&s=computers-intl-ship&sr=1-1570,4.5 out of 5 stars,8,$11.88,Mouse
