,name,product_url,rating,review_count,price,product_type
1754,"RGB Gaming Surface Mouse Mat for League of Legends- DJ Yasuo,Non Slip Rubber Base,Waterproof,Smooth Gaming Surface,10 Lighting Modes,LED Soft Extended Mouse Mat,Desk pad,for Computer 11.8x31.5 inch",https://www.amazon.com/Legends-Waterproof-Lighting-Extended-11-8x31-5/dp/B0881P7F3B/ref=sr_1_2208?dchild=1&keywords=mouse&qid=1594378041&s=computers-intl-ship&sr=1-2208,,,$29.88,Mouse
1755,Old Vintage Abstract Piano and Music Note Customized Rectangle Non-Slip Rubber Mouse pad Gaming Mouse Pad by Smooffly,https://www.amazon.com/Abstract-Customized-Rectangle-Mouse-Pad/dp/B07B9W9VXV/ref=sr_1_2209?dchild=1&keywords=mouse&qid=1594378041&s=computers-intl-ship&sr=1-2209,4.8 out of 5 stars,8,$7.89,Mouse
1756,ICONIC - PRO Gaming Mouse Pad with Stitched Edges - XXL Extra Large Gaming Desk Black Cloth Mousepad - Water Proof Non-Slip Rubber Base (40x18x0.12 Inches),https://www.amazon.com/ICONIC-Stitched-Mousepad-Non-Slip-40x18x0-12/dp/B07Z9VM63K/ref=sr_1_2210?dchild=1&keywords=mouse&qid=1594378041&s=computers-intl-ship&sr=1-2210,5.0 out of 5 stars,4,$32.99,Mouse
1757,"RGB Gaming Mouse Pad for League of Legends,LED Soft Extra Extended Large Mouse Pad,Anti-Slip Rubber Base,Computer Keyboard Mouse Mat 31.5 X 12 Inch(Zoe)",https://www.amazon.com/Legends-Extended-Anti-Slip-Computer-Keyboard/dp/B083TB99LX/ref=sr_1_2211?dchild=1&keywords=mouse&qid=1594378041&s=computers-intl-ship&sr=1-2211,2.0 out of 5 stars,1,$29.88,Mouse
1758,Cat Paws Mouse pad Gaming Mouse pad Mousepad Nonslip Rubber Backing,https://www.amazon.com/Gaming-Mousepad-Nonslip-Rubber-Backing/dp/B06XBLBLLD/ref=sr_1_2212?dchild=1&keywords=mouse&qid=1594378041&s=computers-intl-ship&sr=1-2212,4.2 out of 5 stars,21,$7.99,Mouse
1759,"VictMao Extended Gaming Mouse Pad, Thick Large (31.5×15.75×0.12 Inch) Computer Keyboard Mousepad Mouse Mat, Water-Resistant, Non-Slip Base, Durable Stitched Edges, Ideal for Both Gaming",https://www.amazon.com/VictMao-Extended-31-5%C3%9715-75%C3%970-12-Computer-Water-Resistant/dp/B07TDZ1WFZ/ref=sr_1_2211?dchild=1&keywords=mouse&qid=1594378041&s=computers-intl-ship&sr=1-2211,4.6 out of 5 stars,8,$9.99,Mouse
1760,"Adjustable Lap Desk - with 8 Adjustable Angles & Dual Cushions Laptop Stand for Car Laptop Desk, Work Table, Lap Writing Board & Drawing Desk on Sofa or Bed (Black with Mouse pad, 1 Pack)",https://www.amazon.com/Adjustable-Lap-Desk-Cushions-Writing/dp/B07YZJZHM4/ref=sr_1_2213?dchild=1&keywords=mouse&qid=1594378041&s=computers-intl-ship&sr=1-2213,4.0 out of 5 stars,170,$35.98,Mouse
1761,"Mouse Pad Leather Wrist Rest Support, Ergonomic Memory Foam Mouse Wrist Rest Pad with Non-Slip Rubber Base, Durable & Comfortable Mousepad for Computer Pain Relief at Home, Office, Work Travel, Black",https://www.amazon.com/Ergonomic-Non-Slip-Comfortable-Mousepad-Computer/dp/B0852GR42G/ref=sr_1_2214?dchild=1&keywords=mouse&qid=1594378041&s=computers-intl-ship&sr=1-2214,5.0 out of 5 stars,1,$12.99,Mouse
1762,CHERRY DC 2000 Keyboard & Mouse Combo - Wired - 4 Hot Keys,https://www.amazon.com/Cherry-JD-0800EU-2-2000-Keyboard-Mouse/dp/B00ZRWGTRE/ref=sr_1_2216?dchild=1&keywords=mouse&qid=1594378041&s=computers-intl-ship&sr=1-2216,4.7 out of 5 stars,6,$16.80,Mouse
1763,WallScrollPosters One Piece Anime Featuring Sexy Nico Robin Breast Boob Oppai Mouse pad,https://www.amazon.com/WallScrollPosters-Alfombrilla-rat%C3%B3n-dise%C3%B1o-Robin/dp/B087PR5N8F/ref=sr_1_2217?dchild=1&keywords=mouse&qid=1594378041&s=computers-intl-ship&sr=1-2217,,,$32.99,Mouse
1764,Suike Mousepad Computer Notepad Office Cardinal Block with Tree Home School Game Player Computer Worker 9.5x7.9 Inch,https://www.amazon.com/Suike-Mousepad-Computer-Notepad-Cardinal/dp/B07WQQWXRW/ref=sr_1_2222?dchild=1&keywords=mouse&qid=1594378041&s=computers-intl-ship&sr=1-2222,3.0 out of 5 stars,1,$5.99,Mouse
1765,"3D Rose""Galaxy Deathly Hallows"" Matte Finish Mouse Pad - 8 x 8"" - mp_221434_1",https://www.amazon.com/Galaxy-Deathly-Hallows-Matte-Finish/dp/B016PFL5CU/ref=sr_1_2225?dchild=1&keywords=mouse&qid=1594378041&s=computers-intl-ship&sr=1-2225,4.2 out of 5 stars,5,$18.36,Mouse
1766,"Cat Mouse Pad by Smooffly,Cute Black Cat Face Mousepad with Rubber 20cm",https://www.amazon.com/Mouse-Smooffly-Black-Mousepad-Rubber/dp/B079Q7BBMP/ref=sr_1_2226?dchild=1&keywords=mouse&qid=1594378041&s=computers-intl-ship&sr=1-2226,5.0 out of 5 stars,7,$7.89,Mouse
1767,Smooffly Mouse Pad Purple Galaxy Customized Rectangle Non-Slip Rubber Mousepad Gaming Mouse Pad Mat,https://www.amazon.com/Smooffly-Customized-Rectangle-Non-Slip-Mousepad/dp/B079YQNCF8/ref=sr_1_2227?dchild=1&keywords=mouse&qid=1594378041&s=computers-intl-ship&sr=1-2227,4.6 out of 5 stars,4,$7.89,Mouse
1768,"Smooffly Cactus Gaming Mouse Pad,Green Plants Cactus Flower Mouse Pad 9.5 X 7.9 Inch (240mmX200mmX3mm)",https://www.amazon.com/Smooffly-Cactus-Gaming-Plants-240mmX200mmX3mm/dp/B07C7SJ6XH/ref=sr_1_2228?dchild=1&keywords=mouse&qid=1594378041&s=computers-intl-ship&sr=1-2228,4.7 out of 5 stars,10,$7.89,Mouse
1769,"2.4GHz and Bluetooth 4.0 Dual Mode Rechargeable Mouse, LAOPAO Optical Mice Work on Two Devices for PC, Mac, Laptop, Android Tablet (Black)",https://www.amazon.com/Bluetooth-Rechargeable-LAOPAO-Optical-Devices/dp/B07FH7BQ8C/ref=sr_1_2232?dchild=1&keywords=mouse&qid=1594378041&s=computers-intl-ship&sr=1-2232,3.7 out of 5 stars,127,$22.88,Mouse
1770,"Smooffly France Paris Mouse Pad, Spring Morning with Eiffel Tower, Cityscape Red Flower Personality Desings Gaming Mouse Pad",https://www.amazon.com/dp/B07C7F7B76/ref=sr_1_2233?dchild=1&keywords=mouse&qid=1594378041&s=computers-intl-ship&sr=1-2233,5.0 out of 5 stars,7,$7.89,Mouse
1771,"Sunnolimit 4 Pack Keyboard Wrist Support Bar and Ergonomic Mouse Wrist Rest Pads Set - for Computer,Laptop,Gaming and Office",https://www.amazon.com/Sunnolimit-Keyboard-Wrist-Support-Ergonomic/dp/B087MXYB94/ref=sr_1_2237?dchild=1&keywords=mouse&qid=1594378041&s=computers-intl-ship&sr=1-2237,5.0 out of 5 stars,2,$11.99,Mouse
1772,Koonice Hard Case Compatible for Apple Magic Mouse (I and II 2nd Gen) Including Carabiner (Beige),https://www.amazon.com/Koonice-Compatible-Apple-Including-Carabiner/dp/B07J44Y9YM/ref=sr_1_2238?dchild=1&keywords=mouse&qid=1594378041&s=computers-intl-ship&sr=1-2238,5.0 out of 5 stars,1,$9.99,Mouse
1773,Mionix Avior Frosting Ambidextrous Optical Gaming Mouse (Peach/Pink),https://www.amazon.com/Mionix-Frosting-Ambidextrous-Optical-Gaming/dp/B077BKH4G9/ref=sr_1_2239?dchild=1&keywords=mouse&qid=1594378041&s=computers-intl-ship&sr=1-2239,3.9 out of 5 stars,224,$14.99,Mouse
1774,Fundior Mouse Bungee Mouse Cord Management Fixer Holder (Black),https://www.amazon.com/Fundior-Mouse-Bungee-Management-Holder/dp/B01CBSOWBQ/ref=sr_1_2241?dchild=1&keywords=mouse&qid=1594378041&s=computers-intl-ship&sr=1-2241,4.3 out of 5 stars,32,$9.69,Mouse
1775,"Home Advantage Mouse Pads Bulk Pack, 8 inch x 9 3/8 inch Smooth Fabric Mousing Surface (Black, 10-Pack)",https://www.amazon.com/Home-Advantage-Mousing-Surface-10-Pack/dp/B07CPJP1V7/ref=sr_1_2242?dchild=1&keywords=mouse&qid=1594378041&s=computers-intl-ship&sr=1-2242,4.0 out of 5 stars,1,$38.00,Mouse
1776,Roccat Kain 202 Aimo RGB Gaming Mouse - White,https://www.amazon.com/Roccat-Kain-Aimo-Gaming-Mouse/dp/B07YQJ34H7/ref=sr_1_2243?dchild=1&keywords=mouse&qid=1594378041&s=computers-intl-ship&sr=1-2243,4.4 out of 5 stars,211,$94.86,Mouse
1777,KOOLmouse [ Optical 2.4G Wireless Computer Mouse ] [ Cute Dog Paw Print ],https://www.amazon.com/KOOLmouse-Optical-Wireless-Computer-Mouse/dp/B06XRQTXP4/ref=sr_1_2244?dchild=1&keywords=mouse&qid=1594378041&s=computers-intl-ship&sr=1-2244,3.4 out of 5 stars,3,$19.95,Mouse
1778,"Fellowes Mouse Pad with Microban Antimicrobial Protection, Graphite (5934001)",https://www.amazon.com/Fellowes-Microban-Antimicrobial-Protection-5934001/dp/B0002CE0WK/ref=sr_1_2243?dchild=1&keywords=mouse&qid=1594378041&s=computers-intl-ship&sr=1-2243,4.2 out of 5 stars,39,$8.12,Mouse
1779,MSI Gaming 5000 Adjustable DPI RGB USB Gaming Grade Optical Wired Gaming Mouse (Clutch GM11),https://www.amazon.com/MSI-Gaming-Adjustable-Optical-Clutch/dp/B07WRLXBBV/ref=sr_1_2244?dchild=1&keywords=mouse&qid=1594378041&s=computers-intl-ship&sr=1-2244,4.8 out of 5 stars,12,$24.99,Mouse
1780,"Smooffly Gaming Mouse Pad Custom,Fantasy Unicorn Faries Customized Rectangle Non-Slip Rubber Mousepad Gaming Mouse Pad",https://www.amazon.com/Smooffly-Customized-Rectangle-Non-Slip-Mousepad/dp/B078ZDMHMD/ref=sr_1_2245?dchild=1&keywords=mouse&qid=1594378041&s=computers-intl-ship&sr=1-2245,4.8 out of 5 stars,8,$7.89,Mouse
1781,"Hard Gaming Mouse Pad, 10 RGB Lighting Modes - 13.7x10.3 inches - Non-Slip Rubber Base",https://www.amazon.com/Hard-Gaming-Mouse-Lighting-Modes/dp/B087R2HHLS/ref=sr_1_2246?dchild=1&keywords=mouse&qid=1594378041&s=computers-intl-ship&sr=1-2246,5.0 out of 5 stars,3,$39.99,Mouse
1782,"MOSISO Wrist Rest Support for Mouse Pad & Keyboard Set, Ergonomic Mousepad Non-Slip Rubber Base Home/Office Pain Relief & Easy Typing Cushion with Neoprene Cloth & Raised Memory Foam, Colorful Marble",https://www.amazon.com/MOSISO-Keyboard-Ergonomic-Mousepad-Non-Slip/dp/B07ZH6M68K/ref=sr_1_2247?dchild=1&keywords=mouse&qid=1594378041&s=computers-intl-ship&sr=1-2247,4.7 out of 5 stars,19,$17.99,Mouse
1783,Evoluent VMCR VerticalMouse C Right Hand Ergonomic Mouse with Wired USB Connection (Regular Size),https://www.amazon.com/Evoluent-VerticalMouse-Ergonomic-Connection-Regular/dp/B01BNYDWJM/ref=sr_1_2248?dchild=1&keywords=mouse&qid=1594378041&s=computers-intl-ship&sr=1-2248,4.0 out of 5 stars,108,$89.95,Mouse
1784,"Innovera Mouse Pad with Gel Wrist Pad, Nonskid Base, 10-3/8 x 8-7/8 Inches, Black (50448)",https://www.amazon.com/Innovera-Mouse-Nonskid-Inches-50448/dp/B001E6BUKI/ref=sr_1_2250?dchild=1&keywords=mouse&qid=1594378041&s=computers-intl-ship&sr=1-2250,4.6 out of 5 stars,157,$12.79,Mouse
1785,"URMI Keyboard Wrist Rest Support Pad Set, Anti-Skid Ergonomic Gel Wrist Cushion Support with Memory Foam for Mac Computer Laptop Working Gaming Home (Mouse Pad Wrist Rest)",https://www.amazon.com/URMI-Keyboard-Anti-Skid-Ergonomic-Computer/dp/B0834D7ZN9/ref=sr_1_2253?dchild=1&keywords=mouse&qid=1594378041&s=computers-intl-ship&sr=1-2253,4.5 out of 5 stars,215,$12.88,Mouse
1786,"SANWA (Japan Brand) 2.4Ghz Wireless Vertical Ergonomic Mouse, Blue LED Optical Computer Mice, (800/1200/1600 DPI, 6 Buttons) Compatible with MacBook, Laptop, Windows Android Mac OS for Office Gam",https://www.amazon.com/SANWA-Wireless-Ergonomic-Adjustable-GMAERGW10/dp/B075WQW8J1/ref=sr_1_2254?dchild=1&keywords=mouse&qid=1594378041&s=computers-intl-ship&sr=1-2254,4.1 out of 5 stars,38,$21.99,Mouse
1787,"Mouse Pad Compatible League of Legends-Lux,Waterproof Mouse Mat,Extended Gaming Mouse Pad,Large Desk Mat,Non-Slip Base Anti-Dirty Stitched Edges Mousepad for Computer Black 11.8x23.6inch",https://www.amazon.com/Compatible-Legends-Lux-Waterproof-Anti-Dirty-11-8x23-6inch/dp/B083SL5CM8/ref=sr_1_2255?dchild=1&keywords=mouse&qid=1594378041&s=computers-intl-ship&sr=1-2255,4.0 out of 5 stars,2,$16.99,Mouse
1788,"Logitech K800 Wireless Illuminated Keyboard — Backlit Keyboard, Fast-Charging, Dropout-Free 2.4GHz Connection",https://www.amazon.com/Logitech-K800-Wireless-Illuminated-Keyboard/dp/B003VAGXWK/ref=sr_1_2256?dchild=1&keywords=mouse&qid=1594378041&s=computers-intl-ship&sr=1-2256,4.1 out of 5 stars,"6,352",,Mouse
1789,"Wow!Pad LFR48 11.5"" x 12.5"" Graphite Gaming Pad",https://www.amazon.com/dp/B000F3IS8I/ref=sr_1_2257?dchild=1&keywords=mouse&qid=1594378041&s=computers-intl-ship&sr=1-2257,4.3 out of 5 stars,262,$16.99,Mouse
1790,Green Abalone Seashell Round Mouse Pad. Colorful Cute Design with Non Slip Base. Matching Microfiber Cleaning Cloth for Eye Glasses & Electronics. Cool Mouse Pad for Laptop & Travel,https://www.amazon.com/Seashell-Colorful-Matching-Microfiber-Electronics/dp/B07GBFXFRR/ref=sr_1_2258?dchild=1&keywords=mouse&qid=1594378041&s=computers-intl-ship&sr=1-2258,4.8 out of 5 stars,175,$9.99,Mouse
1791,"Turquoise blue oil paint texture Mouse Pad mouse mouse pad Mouse Pad Pad Office Mouse Pad Gaming Mouse Pad Mat Mouse Pad mousepad Dimension: 9.5"" x 7.9""",https://www.amazon.com/Turquoise-texture-Office-mousepad-Dimension/dp/B06XNT6QKM/ref=sr_1_2259?dchild=1&keywords=mouse&qid=1594378041&s=computers-intl-ship&sr=1-2259,4.6 out of 5 stars,24,$7.99,Mouse
1792,Cute Fox Drinking a Cup of Tea Interesting Unique Design Gaming Mouse Pad,https://www.amazon.com/Drinking-Interesting-Unique-Design-Gaming/dp/B07RZQZBCR/ref=sr_1_2260?dchild=1&keywords=mouse&qid=1594378041&s=computers-intl-ship&sr=1-2260,4.7 out of 5 stars,4,$5.99,Mouse
1793,G-Wolves Hati Stardust (Limited Edition) Ultra Lightweight Honeycomb Design Wired Gaming Mouse up to 12000 cpi - 3389 Performance Sensor - (58g) (Blue),https://www.amazon.com/G-Wolves-Hati-Stardust-Lightweight-Honeycomb/dp/B086JFWKT6/ref=sr_1_2264?dchild=1&keywords=mouse&qid=1594378041&s=computers-intl-ship&sr=1-2264,4.5 out of 5 stars,9,$99.99,Mouse
1794,Air Mouse 2.4G Backlit Remote Control Mini Keyboard Backlight MX3 Mini Wireless Keyboard Infrared Remote Control Learning Best for Android Smart TV Box HTPC IPTV PC Pad Xbox Windows iOS MAC,https://www.amazon.com/Keyboard-Backlight-Wireless-Infrared-Learning/dp/B07Y9WPTGS/ref=sr_1_2275?dchild=1&keywords=mouse&qid=1594378041&s=computers-intl-ship&sr=1-2275,3.8 out of 5 stars,10,$22.89,Mouse
1795,Adesso iMouse E90 - Wireless Left-Handed Vertical Ergonomic Mouse,https://www.amazon.com/Adesso-iMouse-E90-Left-Handed-Ergonomic/dp/B01MURPI00/ref=sr_1_2276?dchild=1&keywords=mouse&qid=1594378041&s=computers-intl-ship&sr=1-2276,3.7 out of 5 stars,50,$36.99,Mouse
1796,Wolf Howling At The Moon Rectangle Mouse Pad 240x200x3mm At Colored Cases Store,https://www.amazon.com/Howling-Rectangle-Mouse-240x200x3mm-Colored/dp/B00S55XQVC/ref=sr_1_2277?dchild=1&keywords=mouse&qid=1594378041&s=computers-intl-ship&sr=1-2277,4.7 out of 5 stars,48,$4.90,Mouse
1797,"Razer Viper Ultralight Ambidextrous Wired Gaming Mouse: Fastest Mouse Switch in Gaming - 16,000 DPI Optical Sensor - Chroma RGB Lighting - 8 Programmable Buttons - Drag-Free Cord (Renewed)",https://www.amazon.com/Razer-Viper-Ultralight-Ambidextrous-Gaming/dp/B07ZTYJHN3/ref=sr_1_2278?dchild=1&keywords=mouse&qid=1594378041&s=computers-intl-ship&sr=1-2278,4.0 out of 5 stars,51,$48.95,Mouse
1798,JoJo's Bizarre Adventure Large Anime Mouse Pad XXL Extended Mat Desk Pad Gaming Mouse pad Long Non-Slip Rubber Mice Pads,https://www.amazon.com/Bizarre-Adventure-Extended-Non-Slip-Rubber/dp/B07PZFN9D4/ref=sr_1_2279?dchild=1&keywords=mouse&qid=1594378041&s=computers-intl-ship&sr=1-2279,4.7 out of 5 stars,13,$25.00,Mouse
1799,Onn Wireless Mouse - Pink Be Flamazing!,https://www.amazon.com/Onn-Wireless-Mouse-Pink-Flamazing/dp/B0876G34ZL/ref=sr_1_2281?dchild=1&keywords=mouse&qid=1594378041&s=computers-intl-ship&sr=1-2281,,,$19.99,Mouse
1800,"Dogs Galore Mouse Pad Custom, Cute Pets Puppies Mouse Pads Large Funny Mat",https://www.amazon.com/Knseva-Galore-Mouse-Pad-Puppies/dp/B07BRZYJGV/ref=sr_1_2282?dchild=1&keywords=mouse&qid=1594378041&s=computers-intl-ship&sr=1-2282,4.0 out of 5 stars,5,$7.99,Mouse
1801,"Metal Mouse pad mat,Aluminum Alloy Mouse Pads, Double-Sided,Waterproof,Smooth,Computer Mouse pad, Suitable for Gaming Office Home Personal Use Medium 8.7""x7.0"" (Small Gray)",https://www.amazon.com/Aluminum-Double-Sided-Waterproof-Computer-Suitable/dp/B0837CRVWV/ref=sr_1_2285?dchild=1&keywords=mouse&qid=1594378041&s=computers-intl-ship&sr=1-2285,3.5 out of 5 stars,13,$11.99,Mouse
1802,"Smooffly Gaming Mouse Pad Custom,United States Map Non-Slip Thick Rubber Mouse pad,9.5 X 7.9 Inch (240mmX200mmX3mm)",https://www.amazon.com/Smooffly-Gaming-Custom-Non-Slip-240mmX200mmX3mm/dp/B078ZCGVJ6/ref=sr_1_2287?dchild=1&keywords=mouse&qid=1594378041&s=computers-intl-ship&sr=1-2287,3.9 out of 5 stars,14,$7.89,Mouse
1803,"ELECOM Mobile Less-Noise Switch Trackball Mouse, Index-Finger Operation & Wireless Connection Model with Carrying Case, M-MT2DRSBK",https://www.amazon.com/M-MT2DRSBK/dp/B07ZRG3RW3/ref=sr_1_2288?dchild=1&keywords=mouse&qid=1594378041&s=computers-intl-ship&sr=1-2288,3.7 out of 5 stars,153,$59.99,Mouse
1804,"Extra Large (X-Large) Size Non-Slip Rectangle Mousepad, FINCIBO Solid Favorite Red Mouse Pad for Home, Office and Gaming Desk",https://www.amazon.com/Non-Slip-Rectangle-Mousepad-FINCIBO-Favorite/dp/B07BYMD376/ref=sr_1_2289?dchild=1&keywords=mouse&qid=1594378041&s=computers-intl-ship&sr=1-2289,4.7 out of 5 stars,9,$9.89,Mouse
1805,"Wantu Large Extended Gaming Mouse Pad ，2mm Thick Water-Resistant Mouse Mat, Washable,Durable Stitched Edges， Non-Slip Rubber Base Mats for Computers, Laptop (Compass map)",https://www.amazon.com/Extended-Water-Resistant-Washable-Stitched-Computers/dp/B07M8FV3L4/ref=sr_1_2290?dchild=1&keywords=mouse&qid=1594378041&s=computers-intl-ship&sr=1-2290,3.0 out of 5 stars,1,$7.68,Mouse
1806,"Mouse Pad for Rick & Morty Rick & Morty Trippy,Non-Slip Rubber Base,Stitched Edges,Waterproof,High Speed Tracking Surface,High-Performance Mouse Mat,for Computer 11.8x23.6 Inch",https://www.amazon.com/Non-Slip-Stitched-Waterproof-High-Performance-11-8x23-6/dp/B087TGVTYM/ref=sr_1_2291?dchild=1&keywords=mouse&qid=1594378041&s=computers-intl-ship&sr=1-2291,,,$16.99,Mouse
1807,Yoga Dogs Funny Design Personalized Rectangle Mouse Pad,https://www.amazon.com/Funny-Design-Personalized-Rectangle-Mouse/dp/B00LO6Z9V4/ref=sr_1_2292?dchild=1&keywords=mouse&qid=1594378041&s=computers-intl-ship&sr=1-2292,4.3 out of 5 stars,34,$4.69,Mouse
1808,Logitech M331 Silent Plus Wireless Mouse with Nano Receiver -International Version- (Red),https://www.amazon.com/Logitech-M331-Wireless-Receiver-International/dp/B01MQI89HD/ref=sr_1_2291?dchild=1&keywords=mouse&qid=1594378041&s=computers-intl-ship&sr=1-2291,4.9 out of 5 stars,7,$46.99,Mouse
1809,3dRose 1 Durable Mouse Pad (mp_266056_1),https://www.amazon.com/dp/B0777QTBG4/ref=sr_1_2292?dchild=1&keywords=mouse&qid=1594378041&s=computers-intl-ship&sr=1-2292,5.0 out of 5 stars,5,$18.48,Mouse
1810,Adesso iMouse E1 - Vertical Ergonomic Illuminated Mouse - Optical - Cable - Glossy Black - USB - 1600 dpi - Scroll Wheel - 6 Button(s) - Right-Handed Only - IMOUSE E1,https://www.amazon.com/Adesso-iMouse-E1-Illuminated-Right-handed/dp/B00JJRYWN6/ref=sr_1_2293?dchild=1&keywords=mouse&qid=1594378041&s=computers-intl-ship&sr=1-2293,5.0 out of 5 stars,2,$35.51,Mouse
1811,"RGB Mouse Pad, Gaming Mouse Pad 800×300×4mm, 12 Kinds of Lighting Effects, Waterproof and Smooth Surface, Non Slip Rubber Base, Suitable for Gamers,Homes, Offices",https://www.amazon.com/800%C3%97300%C3%974mm-Lighting-Effects-Waterproof-Suitable/dp/B087RBYP4M/ref=sr_1_2294?dchild=1&keywords=mouse&qid=1594378041&s=computers-intl-ship&sr=1-2294,5.0 out of 5 stars,5,$16.89,Mouse
1812,"Professional Large Gaming Mouse Pad Extended Mouse Mat Waterproof Mouse Pad with Non-Slip Rubber Base Game Mouse Mat Ideal for Desk Cover, Computer Keyboard, PC and Laptop (90x40 daguaiY38)",https://www.amazon.com/Professional-Extended-Waterproof-Non-Slip-90x40-daguaiY38/dp/B07R7CV8K3/ref=sr_1_2295?dchild=1&keywords=mouse&qid=1594378041&s=computers-intl-ship&sr=1-2295,4.8 out of 5 stars,18,$15.99,Mouse
1813,"RGB Extended Size Mouse Pad for Rick & Morty,Nonskid Rubber Base, Waterproof,Smooth Gaming Surface,10 Lighting Modes,LED Soft Extended Mouse Mat,Desk pad,for Computer 11.8x31.5 inch",https://www.amazon.com/Extended-Waterproof-Lighting-Computer-11-8x31-5/dp/B0881NRWRF/ref=sr_1_2296?dchild=1&keywords=mouse&qid=1594378041&s=computers-intl-ship&sr=1-2296,,,$29.88,Mouse
1814,"Round Mouse Pads,iNeworld Cute Elephant Waterproof Thick Keyboard Mouse Pad Non-Slip Nature Rubber for Gaming Office Working Home Mouse Mat",https://www.amazon.com/iNeworld-Elephant-Waterproof-Keyboard-Non-Slip/dp/B07XD1X3MN/ref=sr_1_2298?dchild=1&keywords=mouse&qid=1594378041&s=computers-intl-ship&sr=1-2298,5.0 out of 5 stars,2,$7.59,Mouse
1815,"Ambesonne United States Mouse Pad, Vintage Constitution Text of America National Glory 4th of July Image, Rectangle Non-Slip Rubber Mousepad, Standard Size, Pale Brown",https://www.amazon.com/Ambesonne-Constitution-National-Standard-Rectangle/dp/B07BHQHBTB/ref=sr_1_2301?dchild=1&keywords=mouse&qid=1594378041&s=computers-intl-ship&sr=1-2301,4.6 out of 5 stars,3,$7.95,Mouse
1816,GIGABYTE AORUS RGB 16000 dpi Optical Sensor Fully Programmable and Saved Onboard 16.7M Customizable Lighting Gaming Mouse - GM-AORUS M5,https://www.amazon.com/GIGABYTE-Optical-Programmable-Customizable-Lighting/dp/B07HCXT59D/ref=sr_1_2302?dchild=1&keywords=mouse&qid=1594378041&s=computers-intl-ship&sr=1-2302,3.3 out of 5 stars,11,$66.57,Mouse
1817,Lovely Cute Mice Silhouettes Red Heart Design Print Image Desktop Office Silicone Mouse Pad by Trendy Accessories,https://www.amazon.com/Silhouettes-Desktop-Silicone-Trendy-Accessories/dp/B01D9X81HI/ref=sr_1_2303?dchild=1&keywords=mouse&qid=1594378041&s=computers-intl-ship&sr=1-2303,5.0 out of 5 stars,9,$12.95,Mouse
1818,"Logitech G502 Hero High Performance Gaming Mouse Special Edition, Hero 16K Sensor, 16 000 DPI, RGB, Adjustable Weights, 11 Programmable Buttons, On-Board Memory, PC/Mac - German Pack - Black/White",https://www.amazon.com/Logitech-Performance-Special-Adjustable-Programmable/dp/B07W6JP8N2/ref=sr_1_2304?dchild=1&keywords=mouse&qid=1594378041&s=computers-intl-ship&sr=1-2304,4.6 out of 5 stars,"8,235",$62.86,Mouse
1819,Marphe Mouse Pad with Wrist Support Green Pattern Headset Music Elephant Mousepad Non-Slip Rubber Gaming Wrist Rest Mouse Pads for Computers Laptop,https://www.amazon.com/Marphe-Elephant-Mousepad-Non-Slip-Computers/dp/B083GXMR7T/ref=sr_1_2305?dchild=1&keywords=mouse&qid=1594378041&s=computers-intl-ship&sr=1-2305,4.5 out of 5 stars,10,$10.96,Mouse
1820,ASUS ROG Strix Edge Call of Duty (Black Ops 4 Edition) Gaming Mouse Pad - Smooth Surface Optimized for Accurate Tracking | Durable Anti-Fray Stitching | Non-Slip Rubber Base | Light & Portable,https://www.amazon.com/ROG-Strix-Edge-Call-Duty/dp/B07HK91ZQ1/ref=sr_1_2306?dchild=1&keywords=mouse&qid=1594378041&s=computers-intl-ship&sr=1-2306,4.3 out of 5 stars,39,$25.41,Mouse
1821,EDGE 101 Optical Gaming Mouse,https://www.amazon.com/EDGE-101-Optical-Gaming-Mouse/dp/B00ZUNOX9Q/ref=sr_1_2307?dchild=1&keywords=mouse&qid=1594378041&s=computers-intl-ship&sr=1-2307,3.7 out of 5 stars,17,$39.99,Mouse
1822,"VictMao Mouse Pad, Round Working Mouse Pad with Non-Slip Rubber Base, Cute Mouse Mat Waterproof Perfect for Laptop, Computer & PC, 8.0 x 8.0 x 0.12 Inch, R1",https://www.amazon.com/VictMao-Working-Non-Slip-Waterproof-Computer/dp/B07VGJT1SL/ref=sr_1_2308?dchild=1&keywords=mouse&qid=1594378041&s=computers-intl-ship&sr=1-2308,5.0 out of 5 stars,9,$3.99,Mouse
1823,"AUTLEY Wireless Ergonomic Mouse for Small Hands, 2.4G Optical Vertical Mouse Wireless Mouse with Adjustable DPI 800/1200 / 1600, Black",https://www.amazon.com/gp/slredirect/picassoRedirect.html/ref=pa_sp_btf_computers-intl-ship_sr_pg144_1?ie=UTF8&adId=A06303602QY1AFXXE6W85&url=%2FWireless-Ergonomic-Optical-Vertical-Adjustable%2Fdp%2FB07HM8ZYYX%2Fref%3Dsr_1_2310_sspa%3Fdchild%3D1%26keywords%3Dmouse%26qid%3D1594378041%26s%3Dcomputers-intl-ship%26sr%3D1-2310-spons%26psc%3D1&qualifier=1594462120&id=662487538294760&widgetName=sp_btf,4.3 out of 5 stars,41,$15.99,Mouse
1824,Nayo The Corgi - Mouse Pad Collection (3D Butt (3 Colors)),https://www.amazon.com/Nayo-Corgi-Butt-Mouse-Pad/dp/B076GVZCGK/ref=sr_1_2307?dchild=1&keywords=mouse&qid=1594378041&s=computers-intl-ship&sr=1-2307,4.7 out of 5 stars,33,$15.99,Mouse
1825,"Mouse Pad Compatible League of Legends-Kai'Sa,Waterproof Mouse Mat,Extended Gaming Mouse Pad,Large Desk Mat,Non-Slip Base Anti-Dirty Stitched Edges Mousepad for Computer Black 11.8x23.6inch",https://www.amazon.com/Compatible-Legends-KaiSa-Waterproof-Anti-Dirty-11-8x23-6inch/dp/B083SKMBSR/ref=sr_1_2308?dchild=1&keywords=mouse&qid=1594378041&s=computers-intl-ship&sr=1-2308,,,$16.99,Mouse
1826,Pepperoni Pizza Round Mouse Pad Delicious Pizza Mouse Pad,https://www.amazon.com/Pepperoni-Pizza-Round-Mouse-Delicious/dp/B01IUX7HY0/ref=sr_1_2309?dchild=1&keywords=mouse&qid=1594378041&s=computers-intl-ship&sr=1-2309,4.3 out of 5 stars,51,$6.99,Mouse
1827,"TRELC Ergonomic Mouse, 2.4G Wireless Vertical Optical Mouse with Adjustable Sensitivity (1000/1600/2400 DPI), 6 Buttons for PC, Desktop, Laptop, Notebook (Black)",https://www.amazon.com/Ergonomic-Wireless-Vertical-Adjustable-Sensitivity-PC/dp/B07P6K875K/ref=sr_1_2310?dchild=1&keywords=mouse&qid=1594378041&s=computers-intl-ship&sr=1-2310,4.1 out of 5 stars,69,$19.99,Mouse
1828,"Memory Foam Non Slip Mouse Pad Wrist Rest,Non Slip Rubber Base, Durable & Comfortable & Lightweight for Easy Typing & Pain Relief-Ergonomic Support for Computer Home Office(Wolf)",https://www.amazon.com/Durable-Comfortable-Lightweight-Relief-Ergonomic-Computer/dp/B085RFG9DQ/ref=sr_1_2312?dchild=1&keywords=mouse&qid=1594378041&s=computers-intl-ship&sr=1-2312,5.0 out of 5 stars,4,$10.98,Mouse
1829,"Rii Mini 2.4G Wireless Keyboard Touchpad Combo,K24T Mini Keyboard and Mouse Como,Rechargable Li-ion Battery-Black,for Windows/Linux/Android",https://www.amazon.com/Rii-Wireless-Keyboard-Rechargable-Battery-Black/dp/B0869HKS62/ref=sr_1_2313?dchild=1&keywords=mouse&qid=1594378041&s=computers-intl-ship&sr=1-2313,4.8 out of 5 stars,69,$9.99,Mouse
1830,"Gaming Mouse Pad, Large Mouse Pad, 12 Kinds of Lighting Effects, Waterproof and Smooth Surface, Non Slip Rubber Base, Suitable for Gamers, Computers, Offices, Homes",https://www.amazon.com/Lighting-Effects-Waterproof-Suitable-Computers/dp/B087RFZZSB/ref=sr_1_2314?dchild=1&keywords=mouse&qid=1594378041&s=computers-intl-ship&sr=1-2314,5.0 out of 5 stars,2,$19.89,Mouse
