,name,product_url,rating,review_count,price,product_type
590,"Gaming Mouse Pad for Rick & Morty Fear and Loathing in Las Vegas,Anti Slip Rubber Base,Stitched Anti-Fray Edges,Waterproof,3mm Thick,High-Performance Mouse Mat,for Computer 11.8x23.6 Inch",https://www.amazon.com/Loathing-Anti-Fray-Waterproof-High-Performance-11-8x23-6/dp/B087TKPM97/ref=sr_1_676?dchild=1&keywords=mouse&qid=1594378041&s=computers-intl-ship&sr=1-676,,,$16.99,Mouse
591,"Gaming Mouse Pad Custom,Doge in Taco Chicken Rolls Flying Across The Galaxy Space Fllow Your Dream Mousepad Mouse Pad Mat Non-Slip Rubber Large Mousepad - 9.8(L）x 11.8(W) inch",https://www.amazon.com/Gaming-Custom-Chicken-Mousepad-Non-Slip/dp/B07X83W8PG/ref=sr_1_680?dchild=1&keywords=mouse&qid=1594378041&s=computers-intl-ship&sr=1-680,4.7 out of 5 stars,100,$7.99,Mouse
592,Custom Bible Verse Pink Sparkles Glitter Pattern Design Mouse Pad,https://www.amazon.com/Custom-Sparkles-Glitter-Pattern-Design/dp/B01COWWWAC/ref=sr_1_681?dchild=1&keywords=mouse&qid=1594378041&s=computers-intl-ship&sr=1-681,4.7 out of 5 stars,156,$7.99,Mouse
593,"INPHIC Large Gaming Mouse Pad Map Extended Computer Keyboard Mat| Stitched Edges, Anti-Fray Cloth Waterproof, Nonslip Base, Comfort Textured for Gamer| Desk| Laptop| Mac| Work| Office& Home|28x12 in",https://www.amazon.com/Extended-Mousepad-Premium-Textured-Waterproof-27-7%C3%9712%C3%970-12in/dp/B07PXWRBCK/ref=sr_1_682?dchild=1&keywords=mouse&qid=1594378041&s=computers-intl-ship&sr=1-682,4.5 out of 5 stars,77,$11.89,Mouse
594,Macally Silent Wireless Bluetooth Mouse for Mac or Windows PC Laptop/Computer - Slim Bluetooth Mouse with Optical Sensor & DPI Switch 800/1200/1600 - Small Wireless Mouse for Easy Travel - Black,https://www.amazon.com/Macally-Wireless-Bluetooth-Windows-Computer/dp/B07NH6CL3F/ref=sr_1_685?dchild=1&keywords=mouse&qid=1594378041&s=computers-intl-ship&sr=1-685,4.0 out of 5 stars,129,$19.99,Mouse
595,"Ambesonne Chicago Skyline Mouse Pad, City of Chicago Flag with High Rise Buildings Scenery National, Rectangle Non-Slip Rubber Mousepad, Standard Size, White Red",https://www.amazon.com/Ambesonne-Buildings-National-Standard-Rectangle/dp/B07BK3FKYS/ref=sr_1_686?dchild=1&keywords=mouse&qid=1594378041&s=computers-intl-ship&sr=1-686,4.5 out of 5 stars,118,$7.95,Mouse
596,Extended Gaming Mouse Pad Espistmo Large Mouse Pad Mat 3mm Thick Waterproof Mouse Mat Gaming Non-Slip Rubber Base (31.4 x 11.8 x 0.12 inches)-Luxury Black Stitched Edge,https://www.amazon.com/Extended-Espistmo-Waterproof-Non-Slip-Stitched/dp/B07RHP39F4/ref=sr_1_687?dchild=1&keywords=mouse&qid=1594378041&s=computers-intl-ship&sr=1-687,4.8 out of 5 stars,8,$7.99,Mouse
597,Cheliz Memory Foam Mouse Pad Mat with Wrist Rest(Colorful Petals),https://www.amazon.com/Cheliz-Memory-Mouse-Colorful-Petals/dp/B072XHMNJ1/ref=sr_1_688?dchild=1&keywords=mouse&qid=1594378041&s=computers-intl-ship&sr=1-688,4.7 out of 5 stars,"1,251",$12.99,Mouse
598,Mickey Mouse and Donald Duck and Goofy Mouse Pad Office Mouse Pad Gaming Mouse Pad Mat Mouse Pad,https://www.amazon.com/Mickey-Mouse-Donald-Office-Gaming/dp/B088T97DM5/ref=sr_1_689?dchild=1&keywords=mouse&qid=1594378041&s=computers-intl-ship&sr=1-689,5.0 out of 5 stars,1,$7.99,Mouse
599,Cool Black Knight Awesome Soldier Classic Movie Unique Design Customized Rectangle Gaming Black Mouse Pad,https://www.amazon.com/Awesome-Classic-Customized-Rectangle-Mousepad/dp/B07QV78YMH/ref=sr_1_690?dchild=1&keywords=mouse&qid=1594378041&s=computers-intl-ship&sr=1-690,4.1 out of 5 stars,25,$12.99,Mouse
600,"Smooffly Gaming Mouse Pad Custom, Christian Bible Verses Scripture Quotes Joshua-1-9 Pink Flowers Art - Be Strong and Courageous God Be with You",https://www.amazon.com/Smooffly-Christian-Scripture-Joshua-1-9-Flowers/dp/B07C71T7H9/ref=sr_1_691?dchild=1&keywords=mouse&qid=1594378041&s=computers-intl-ship&sr=1-691,5.0 out of 5 stars,11,$7.89,Mouse
601,"Earth Grey Moon Customized Round Mouse Pad 7.8""X7.8"" inch",https://www.amazon.com/Earth-Grey-Customized-Round-Mouse/dp/B072JRY5Q2/ref=sr_1_692?dchild=1&keywords=mouse&qid=1594378041&s=computers-intl-ship&sr=1-692,4.6 out of 5 stars,139,$6.99,Mouse
602,Apple Magic Bluetooth Wireless Laser Mouse - A1296 (Renewed),https://www.amazon.com/Apple-Magic-Bluetooth-Wireless-Laser/dp/B0145NHF5K/ref=sr_1_691?dchild=1&keywords=mouse&qid=1594378041&s=computers-intl-ship&sr=1-691,4.0 out of 5 stars,897,$67.05,Mouse
603,"Verbatim Wireless Desktop 8-Button Deluxe Mouse - Ergonomic, Blue LED, Portable Mouse for Mac and Windows – Black (98622),Graphite",https://www.amazon.com/Verbatim-Wireless-Desktop-8-Button-Deluxe/dp/B00YHU0ME8/ref=sr_1_692?dchild=1&keywords=mouse&qid=1594378041&s=computers-intl-ship&sr=1-692,4.4 out of 5 stars,122,$23.99,Mouse
604,"3M Wired Ergonomic Optical Mouse, Patented Vertical Grip Design Keeps Your Hand and Wrist at a Neutral Angle for Comfort, USB/PS2 Plug and Play Compatibility, 6.5' Cord, Small Size, Black (EM500GPS)",https://www.amazon.com/3M-Ergonomic-Patented-Compatibility-EM500GPS/dp/B000F2BP7U/ref=sr_1_693?dchild=1&keywords=mouse&qid=1594378041&s=computers-intl-ship&sr=1-693,3.8 out of 5 stars,"1,340",$63.90,Mouse
605,"Rechargeable Wireless Mouse with 6 Keys,cyclic Illuminating Powered by Li-Polymer Battery,Optical Sensor,Nano USB Receiver,3-Stage DPI speeds for PC,Laptop,Tablet, MacBook etc(Firework Light)",https://www.amazon.com/Rechargeable-Wireless-Illuminating-Li-Polymer-Receiver/dp/B07MXMP48W/ref=sr_1_694?dchild=1&keywords=mouse&qid=1594378041&s=computers-intl-ship&sr=1-694,4.2 out of 5 stars,36,$19.99,Mouse
606,"Acer Predator Cestus 300 RGB Gaming Mouse – Dual Omron switches 70M click lifetime, On board memory and programmable buttons,Black",https://www.amazon.com/Acer-Predator-Cestus-300-Gaming/dp/B078FBYMVS/ref=sr_1_695?dchild=1&keywords=mouse&qid=1594378041&s=computers-intl-ship&sr=1-695,4.2 out of 5 stars,190,$47.99,Mouse
607,Logitech Color Collection Wireless Mouse - Urban Lagoon,https://www.amazon.com/Logitech-Color-Collection-Wireless-Receiver/dp/B07TWYPC6Z/ref=sr_1_696?dchild=1&keywords=mouse&qid=1594378041&s=computers-intl-ship&sr=1-696,4.8 out of 5 stars,8,$28.50,Mouse
608,"HAOCOO Desk Pad, Office Desk Mat 35.4"" ×15.7"" Large Gaming Mouse Pad Durable Extended Computer Mouse Pad Water-Resistant Thick Writing Pads with Non-Slip Rubber Base for Office Home (Blue&Gold Marble)",https://www.amazon.com/HAOCOO-Extended-Computer-Water-Resistant-Non-Slip/dp/B087TY4PSF/ref=sr_1_697?dchild=1&keywords=mouse&qid=1594378041&s=computers-intl-ship&sr=1-697,4.7 out of 5 stars,8,$18.99,Mouse
609,"Extended RGB Gaming Mouse Pad with Nonslip Rubber Base, XL Large LED Keyboard Mat(31.5x11.8x0.16In), Red Dragon",https://www.amazon.com/Extended-Gaming-Nonslip-Keyboard-31-5x11-8x0-16In/dp/B0829MKLNY/ref=sr_1_698?dchild=1&keywords=mouse&qid=1594378041&s=computers-intl-ship&sr=1-698,4.4 out of 5 stars,15,$22.99,Mouse
610,"AirDrive USB Mouse Jiggler White - Mouse Mover Prevents Screen-Saver, Sleep and Standby Mode, Idle Icons",https://www.amazon.com/AirDrive-USB-Mouse-Jiggler-White/dp/B086HWH3M6/ref=sr_1_701?dchild=1&keywords=mouse&qid=1594378041&s=computers-intl-ship&sr=1-701,,,$28.99,Mouse
611,"Smooffly Life Quote Mouse Pad Custom,Always Remember You are Stronger Braver Smarter 9.5X7.9 inches Mouse Pad",https://www.amazon.com/Smooffly-Remember-Stronger-Smarter-9-5X7-9/dp/B07C8C2Z38/ref=sr_1_702?dchild=1&keywords=mouse&qid=1594378041&s=computers-intl-ship&sr=1-702,4.7 out of 5 stars,35,$7.89,Mouse
612,"Wow!Pad Extra Large 9"" x 12.5"" Collegiate Tailgate Gaming Mouse Pad, Made in USA, University of Michigan",https://www.amazon.com/Wow-Pad-Collegiate-Tailgate-University/dp/B07YQLM8DW/ref=sr_1_703?dchild=1&keywords=mouse&qid=1594378041&s=computers-intl-ship&sr=1-703,4.5 out of 5 stars,27,$12.68,Mouse
613,"ASLNSONG Large Gaming Mouse Pad One Piece 24""x12"" XL Extended Mat Desk Pad Rubber Mice Pads",https://www.amazon.com/ASLNSONG-Large-Gaming-Extended-Rubber/dp/B07Q7FVPNH/ref=sr_1_704?dchild=1&keywords=mouse&qid=1594378041&s=computers-intl-ship&sr=1-704,4.8 out of 5 stars,10,$13.98,Mouse
614,Kensington Orbit Trackball Mouse (K64327F),https://www.amazon.com/Kensington-Orbit-Trackball-Mouse-K64327F/dp/B000HEW0KW/ref=sr_1_705?dchild=1&keywords=mouse&qid=1594378041&s=computers-intl-ship&sr=1-705,4.4 out of 5 stars,"1,738",$29.99,Mouse
615,"Large RGB Gaming Mouse Pad - Reawul 14 Modes Oversized Glowing Led Extended Mousepad, Anti-Slip Rubber Base and Waterproof Surface, Extra Large Soft Led Computer Keyboard Mouse Mat - 31.5 x 11.8in",https://www.amazon.com/Oversized-Extended-Mousepad-Non-Slip-Computer/dp/B07RZRTB92/ref=sr_1_706?dchild=1&keywords=mouse&qid=1594378041&s=computers-intl-ship&sr=1-706,4.5 out of 5 stars,94,$24.99,Mouse
616,"Lenovo 600 Wireless Media Mouse, 3 Adjustable DPI Levels, 2-Speed Scroll Wheel, Volume Buttons, Ergonomic Design, Red Optical Sensor, 12-Month Battery, GY50U89282",https://www.amazon.com/Lenovo-Wireless-Adjustable-Ergonomic-GY50U89282/dp/B07W36ZGB2/ref=sr_1_707?dchild=1&keywords=mouse&qid=1594378041&s=computers-intl-ship&sr=1-707,3.7 out of 5 stars,24,$23.21,Mouse
617,"Mini Cute Wireless Mouse, 2.4G 3000DPI Cartoon Animal Ladybug Shape Cordless Computer Mouse Novelty Small Tiny Travel Mouse with USB Receiver(Red)",https://www.amazon.com/Wireless-3000DPI-Cordless-Computer-Receiver/dp/B07RLBBCXF/ref=sr_1_708?dchild=1&keywords=mouse&qid=1594378041&s=computers-intl-ship&sr=1-708,4.3 out of 5 stars,30,$11.99,Mouse
618,"Metal Aluminum Mouse Pad, Office and Gaming Thin Hard Mouse Mat Leather Surface Non-Slip Double Side Precision Silver and Black Mouse Pad for Fast and Accurate Control(Flat)",https://www.amazon.com/Aluminum-Leather-Non-Slip-Precision-Accurate/dp/B07KK6WNQ7/ref=sr_1_717?dchild=1&keywords=mouse&qid=1594378041&s=computers-intl-ship&sr=1-717,4.3 out of 5 stars,101,$9.95,Mouse
619,"Skull Human Skeleton Mouse pad,Human Skeleton Posing Isolated Over Black Background Mouse pad 9.5 X 7.9 Inch (240mmX200mmX3mm)",https://www.amazon.com/Skeleton-Posing-Isolated-Background-240mmX200mmX3mm/dp/B07HQ75LYQ/ref=sr_1_718?dchild=1&keywords=mouse&qid=1594378041&s=computers-intl-ship&sr=1-718,4.7 out of 5 stars,91,$7.89,Mouse
620,"Glorious Model O (Model O- Minus, Glossy White)",https://www.amazon.com/Glorious-PC-Gaming-Race-GOM-GWHITE/dp/B07VRP5MYH/ref=sr_1_719?dchild=1&keywords=mouse&qid=1594378041&s=computers-intl-ship&sr=1-719,4.2 out of 5 stars,668,$69.00,Mouse
621,dealzEpic - Art Mouse Pad - Natural Rubber Mouse Pad w/Printing of Dogs Playing Poker by Cassius Marcellus Coolidge - Stitched Border - 9.5x7.9 inches,https://www.amazon.com/dealzEpic-Printing-Marcellus-Coolidge-Stitched/dp/B01N7KJMWA/ref=sr_1_720?dchild=1&keywords=mouse&qid=1594378041&s=computers-intl-ship&sr=1-720,4.8 out of 5 stars,66,$9.99,Mouse
622,Logitech MediaPlay Cordless Mouse- Blue,https://www.amazon.com/Logitech-MediaPlay-Cordless-Mouse-Blue/dp/B0002SAF3C/ref=sr_1_721?dchild=1&keywords=mouse&qid=1594378041&s=computers-intl-ship&sr=1-721,3.6 out of 5 stars,92,$275.00,Mouse
623,"Fellowes Memory Foam Mouse Pad/Wrist Rest, Black (9176501)",https://www.amazon.com/Fellowes-Memory-Mouse-Wrist-9176501/dp/B000UH9M3E/ref=sr_1_722?dchild=1&keywords=mouse&qid=1594378041&s=computers-intl-ship&sr=1-722,4.1 out of 5 stars,475,$12.30,Mouse
624,Dunder Mifflin Mouse Pad Mat Marble Background,https://www.amazon.com/Dunder-Mifflin-Mouse-Marble-Background/dp/B086M6ZP6T/ref=sr_1_723?dchild=1&keywords=mouse&qid=1594378041&s=computers-intl-ship&sr=1-723,5.0 out of 5 stars,8,$10.88,Mouse
625,LetGoShop Silicone Gel Wrist Rest Heart-Shaped Translucence Ergonomic Mouse Pad Cool Hand Pillow Effectively Wrist Fatigue(Green),https://www.amazon.com/LetGoShop-Heart-Shaped-Translucence-Ergonomic-Effectively/dp/B01DKCPC16/ref=sr_1_724?dchild=1&keywords=mouse&qid=1594378041&s=computers-intl-ship&sr=1-724,4.3 out of 5 stars,"1,288",$8.89,Mouse
626,Ai5G for Tesla Roadster Car Mouse Wireless Sport Car Shape Mouse Laptop Computer Optical Mouse Gaming Mice with 2.4GHz Nano USB LED Headlight Shiny Surface Decoration (Red),https://www.amazon.com/Ai5G-Roadster-Mice-Headlight-Decoration/dp/B07YMRKBY4/ref=sr_1_723?dchild=1&keywords=mouse&qid=1594378041&s=computers-intl-ship&sr=1-723,3.4 out of 5 stars,8,$11.99,Mouse
627,"Smooffly Cats Mouse pad for Computers, Kittens Family Cats Mouse Pad",https://www.amazon.com/Smooffly-Mouse-computers-Kittens-Family/dp/B07CGVB2SV/ref=sr_1_724?dchild=1&keywords=mouse&qid=1594378041&s=computers-intl-ship&sr=1-724,4.9 out of 5 stars,32,$7.89,Mouse
628,"Insten Premium Leather Mouse Pad with Waterproof Coating, Non Slip & Elegant Stitched Edges, Brown",https://www.amazon.com/Premium-Leather-Waterproof-Coating-Stitched/dp/B01E9V523K/ref=sr_1_725?dchild=1&keywords=mouse&qid=1594378041&s=computers-intl-ship&sr=1-725,4.6 out of 5 stars,400,$7.99,Mouse
629,"Blade Hawks Gaming Mouse Pad W Double-Sided Aluminum Core Mouse mat, Non-Slip Rubber Base & Micro Sand Blasting Surface for Fast and Accurate Control,13.5""x9.5""",https://www.amazon.com/Blade-Hawks-Double-Sided-Aluminum-Non-Slip/dp/B075ZN8H26/ref=sr_1_726?dchild=1&keywords=mouse&qid=1594378041&s=computers-intl-ship&sr=1-726,4.7 out of 5 stars,187,$23.99,Mouse
630,Harry Magic School Large Mouse Pad Funny Gift 12x10 Inches Table Mat for Gaming Office Cowork,https://www.amazon.com/School-Inches-Gaming-Office-Cowork/dp/B07Y5QP8PP/ref=sr_1_727?dchild=1&keywords=mouse&qid=1594378041&s=computers-intl-ship&sr=1-727,4.6 out of 5 stars,49,$9.99,Mouse
631,10pcs Mouse Pad Sublimation Blanks Mousepad for Sublimation Transfer Heat Press Printing Crafts,https://www.amazon.com/10pcs-Sublimation-Transfer-Printing-Crafts/dp/B07F6Z3XV4/ref=sr_1_728?dchild=1&keywords=mouse&qid=1594378041&s=computers-intl-ship&sr=1-728,4.7 out of 5 stars,307,,Mouse
632,"Extended Gaming Mouse Pad - Non-Slip Water-Resistant Rubber Base Computer Keyboard Mouse Mat, Durable Gaming Mouse mat XX-Large, Ideal for Work & Game (90x40 zisecarY28)",https://www.amazon.com/Extended-Gaming-Mouse-Water-Resistant-Durable-Gaming/dp/B07R791KFT/ref=sr_1_729?dchild=1&keywords=mouse&qid=1594378041&s=computers-intl-ship&sr=1-729,4.8 out of 5 stars,29,$17.99,Mouse
633,Macally 104 Key USB Wired Keyboard with Apple Shortcut Keys and 3 Button USB Optical Mouse Combo for Mac and Windows PC (MKEYECOMBO),https://www.amazon.com/Macally-Keyboard-Shortcut-Optical-MKEYECOMBO/dp/B01A109UHW/ref=sr_1_730?dchild=1&keywords=mouse&qid=1594378041&s=computers-intl-ship&sr=1-730,3.9 out of 5 stars,496,$31.54,Mouse
634,"SANWA (Japan Brand) Wired Vertical Ergonomic Mouse, Blue LED Optical Computer Mice, (1000/1600 DPI, 6 Buttons) Compatible with MacBook, Laptop, Windows Android Mac OS for Office Gaming",https://www.amazon.com/SANWA-Vertical-Ergonomic-Adjustable-GMAERG9/dp/B075WR97Q1/ref=sr_1_733?dchild=1&keywords=mouse&qid=1594378041&s=computers-intl-ship&sr=1-733,4.1 out of 5 stars,48,$19.99,Mouse
635,NFL Philadelphia Eagles Neoprene Mouse Pad,https://www.amazon.com/NFL-Philadelphia-Eagles-Neoprene-Mouse/dp/B001R2N3DG/ref=sr_1_734?dchild=1&keywords=mouse&qid=1594378041&s=computers-intl-ship&sr=1-734,4.3 out of 5 stars,46,$6.99,Mouse
636,"Cimetech Large Gaming Mouse Pad with Stitched Edges, Non-Slip Rubber Base, Premium-Textured, Waterproof Mousepad Mouse Mat Mouse Pads for Gamer,Laptop & Desktop 10.23 x 8.26 x 0.15 inches, Black",https://www.amazon.com/Cimetech-Stitched-Computer-Non-Slip-10-2x8-3x0-15/dp/B07W5YFM4D/ref=sr_1_735?dchild=1&keywords=mouse&qid=1594378041&s=computers-intl-ship&sr=1-735,4.6 out of 5 stars,136,$4.89,Mouse
637,"RGB Mouse Pad, RGB Gaming Mouse Pad, Large Mouse Pad, Extended Mouse Pad, 32"" x 12"" Long Computer Mouse Pad w/Non-Slip Rubber Base, Smooth Surface Waterproof Keyboard Mouse Pad w/USB Port",https://www.amazon.com/RGB-Gaming-Mouse-Pad-Waterproof/dp/B07RZJRS9V/ref=sr_1_736?dchild=1&keywords=mouse&qid=1594378041&s=computers-intl-ship&sr=1-736,4.4 out of 5 stars,54,$19.86,Mouse
638,Punisher Skull Mouse Pad,https://www.amazon.com/Vertek-Computer-Products-Punisher-Skull/dp/B0131KKRFS/ref=sr_1_737?dchild=1&keywords=mouse&qid=1594378041&s=computers-intl-ship&sr=1-737,4.4 out of 5 stars,34,$6.00,Mouse
639,BT21 Baby Wireless Silent Mouse by Royche (RJ),https://www.amazon.com/BT21-Wireless-Silent-Mouse-Royche/dp/B082RCJ8TQ/ref=sr_1_738?dchild=1&keywords=mouse&qid=1594378041&s=computers-intl-ship&sr=1-738,4.7 out of 5 stars,5,$32.58,Mouse
640,Wired Gaming Mouse 6 Programmable Buttons Ergonomic Mice Colorful LED Light for PC Computer Laptop,https://www.amazon.com/Programmable-Buttons-Ergonomic-Colorful-PC-Computer/dp/B088P8C6JF/ref=sr_1_739?dchild=1&keywords=mouse&qid=1594378041&s=computers-intl-ship&sr=1-739,5.0 out of 5 stars,4,$12.99,Mouse
641,"Handstands Super Mat Extra Large Mouse Pad, 16.5"" x 13"", Gray (15s01)",https://www.amazon.com/Handstands-Super-Extra-Large-15s01/dp/B07B937JCK/ref=sr_1_740?dchild=1&keywords=mouse&qid=1594378041&s=computers-intl-ship&sr=1-740,4.2 out of 5 stars,275,$10.78,Mouse
642,"Wireless Mouse Backlit Rechargeable Mouse Ultra-Thin 2.4Ghz Noiseless Click 3 Adjustable DPI Level Computer Mouse Mini Portable Office Mobile Mouse with USB Receiver for Laptop,Tablet- Black",https://www.amazon.com/gp/slredirect/picassoRedirect.html/ref=pa_sp_btf_computers-intl-ship_sr_pg46_1?ie=UTF8&adId=A099967830PMXGU2J4ZIN&url=%2FWireless-Rechargeable-Ultra-Thin-Noiseless-Adjustable%2Fdp%2FB07XJPJMS4%2Fref%3Dsr_1_742_sspa%3Fdchild%3D1%26keywords%3Dmouse%26qid%3D1594378041%26s%3Dcomputers-intl-ship%26sr%3D1-742-spons%26psc%3D1&qualifier=1594462008&id=7559570080861983&widgetName=sp_btf,4.3 out of 5 stars,11,$15.28,Mouse
643,LeonardCustom- Personalized Rectangle Non-Slip Rubber Mousepad Gaming Mouse Pad/Mat- Marvel Superhero Spider-Man -LCMPV476,https://www.amazon.com/LeonardCustom-Personalized-Rectangle-Mouse-Spider-Man/dp/B017LIDRPI/ref=sr_1_739?dchild=1&keywords=mouse&qid=1594378041&s=computers-intl-ship&sr=1-739,4.6 out of 5 stars,114,$7.00,Mouse
644,Fashionable Cute Animal Baby Dolphin Shape USB Wired Mouse 1600 DPI Optical Mice Mini Small Kids Children Mice for PC Laptop Computer (Blue),https://www.amazon.com/Fashionable-Dolphin-Optical-Children-Computer/dp/B076WTT9S6/ref=sr_1_740?dchild=1&keywords=mouse&qid=1594378041&s=computers-intl-ship&sr=1-740,4.2 out of 5 stars,136,$8.99,Mouse
645,"Creative Text, Non-Slip Rubber Round Mouse Pad, Professional and Comfortable for Mouse to Slip",https://www.amazon.com/Creative-Non-Slip-Rubber-Professional-Comfortable/dp/B075RRHRFT/ref=sr_1_741?dchild=1&keywords=mouse&qid=1594378041&s=computers-intl-ship&sr=1-741,4.7 out of 5 stars,64,$5.30,Mouse
646,"Mouse Bungee, Stageek Aluminium Alloy Gaming Mouse Cable Cord Management System, Flexible Mouse Cable Holder Fixer for Esports Gaming - Black",https://www.amazon.com/Stageek-Aluminium-Management-Flexible-Esports/dp/B07R4RQKMG/ref=sr_1_742?dchild=1&keywords=mouse&qid=1594378041&s=computers-intl-ship&sr=1-742,4.8 out of 5 stars,198,$14.99,Mouse
647,LONGKEY Mouse Pad Standard Size 9.4×7.8×0.12 Inch Computer Mouse Pad with Neoprene Backing and Jersey Surface (Black) (1 Pack),https://www.amazon.com/Standard-9-4%C3%977-8%C3%970-12-Computer-Neoprene-Backing/dp/B07G9ZY68L/ref=sr_1_743?dchild=1&keywords=mouse&qid=1594378041&s=computers-intl-ship&sr=1-743,4.7 out of 5 stars,22,$4.99,Mouse
648,Cheliz Memory Foam Non Slip Mouse Pad Wrist Rest - Durable & Comfortable & Lightweight for Easy Typing & Pain Relief-Ergonomic Support (1-Gray Gold Marble),https://www.amazon.com/Cheliz-Memory-Foam-Mouse-Wrist/dp/B084M2DLBL/ref=sr_1_744?dchild=1&keywords=mouse&qid=1594378041&s=computers-intl-ship&sr=1-744,4.6 out of 5 stars,466,$12.99,Mouse
649,"Wireless Keyboard and Mouse, ElecRat Rechargeable Compact Full Size Wireless Keyboard and Optical Mouse Combo with 2.4GHz USB Receiver for Windows, Laptop, Notebook, PC, Desktop, Computer",https://www.amazon.com/Wireless-Keyboard-ElecRat-Rechargeable-Receiver/dp/B07RWG4LGP/ref=sr_1_745?dchild=1&keywords=mouse&qid=1594378041&s=computers-intl-ship&sr=1-745,4.0 out of 5 stars,63,$33.99,Mouse
650,"M325 Wireless Mouse, Right/Left, Red",https://www.amazon.com/M325-Rat%C3%B3n-inal%C3%A1mbrico-color-rojo/dp/B01JB70J7Q/ref=sr_1_749?dchild=1&keywords=mouse&qid=1594378041&s=computers-intl-ship&sr=1-749,4.9 out of 5 stars,63,$24.99,Mouse
651,Nicokee Butterfly Gaming Mousepad The Magical Mystical Purple Butterfly Mouse Pad Rectangle Mouse Mat for Computer Desk Laptop Office 9.5 X 7.9 Inch Non-Slip Rubber,https://www.amazon.com/Butterfly-Mousepad-Mystical-Rectangle-Computer/dp/B07RXQ6ZJD/ref=sr_1_750?dchild=1&keywords=mouse&qid=1594378041&s=computers-intl-ship&sr=1-750,4.8 out of 5 stars,19,$8.99,Mouse
652,Aluminum Alloy Gaming Mouse Pad Metal Waterproof Small Size Mousepad Computer Game Accessories Muismat for Office Home Use (Silver),https://www.amazon.com/Aluminum-Waterproof-Mousepad-Computer-Accessories/dp/B082L41NGK/ref=sr_1_751?dchild=1&keywords=mouse&qid=1594378041&s=computers-intl-ship&sr=1-751,3.8 out of 5 stars,17,$9.88,Mouse
653,"Zeus Gear XL Gaming Mouse Pad/Mat - Stitched Edges, Black, Natural Rubber | 18""x16""x0.12"" (ZG-AE-XL)",https://www.amazon.com/Zeus-Gear-Gaming-Mouse-Pad/dp/B06XFST99S/ref=sr_1_752?dchild=1&keywords=mouse&qid=1594378041&s=computers-intl-ship&sr=1-752,4.8 out of 5 stars,69,$11.99,Mouse
654,"Wireless Car Mouse,Kamouse Super Cute Car Shaped Mouse USB Computer Optical Gaming Mice with Mini Receiver for PC Notebook Window",https://www.amazon.com/Kamouse-Wireless-Shaped-Computer-Windows/dp/B07QNWMV9C/ref=sr_1_753?dchild=1&keywords=mouse&qid=1594378041&s=computers-intl-ship&sr=1-753,4.6 out of 5 stars,49,$12.99,Mouse
655,2.4GHz USB Wireless Optical Pen Mouse Smart Mouse for PC Laptop Computer (Grey),https://www.amazon.com/2-4GHz-Wireless-Optical-Laptop-Computer/dp/B076CD7LKZ/ref=sr_1_754?dchild=1&keywords=mouse&qid=1594378041&s=computers-intl-ship&sr=1-754,3.8 out of 5 stars,55,$14.99,Mouse
656,Gaming Mouse Pad Customized Extended Large Desk Mat Non-Slip Mouse Mat (120x40 Senlin),https://www.amazon.com/Gaming-Customized-Extended-Non-Slip-120x40/dp/B07MZ85X3Q/ref=sr_1_755?dchild=1&keywords=mouse&qid=1594378041&s=computers-intl-ship&sr=1-755,4.8 out of 5 stars,192,$28.99,Mouse
657,"SubZERO Gaming TYKA Soft Gaming Mouse Pad / Mat, Large Mousepad, Stitched Edges, 18""x16"" (Black)",https://www.amazon.com/SubZERO-Gaming-Mouse-Mousepad-Stitched/dp/B01N7CQVAC/ref=sr_1_756?dchild=1&keywords=mouse&qid=1594378041&s=computers-intl-ship&sr=1-756,4.7 out of 5 stars,209,$14.97,Mouse
658,Rug Mousepad Non-Slip Rubber Gaming Mouse Pad Rectangle Mouse Pads for Computers Laptop - Smooffly,https://www.amazon.com/Mousepad-Non-Slip-Rubber-Rectangle-Computers/dp/B07TM3FGG1/ref=sr_1_761?dchild=1&keywords=mouse&qid=1594378041&s=computers-intl-ship&sr=1-761,4.8 out of 5 stars,54,$7.89,Mouse
659,"MOSISO Mouse Pad Gel Wrist Rest Support, Camellia Ergonomic Mousepad Non-Slip Rubber Base Home/Office Pain Relief&Easy Typing Cushion for Laptop with Neoprene Cloth&Raised Memory Foam, Black",https://www.amazon.com/MOSISO-Ergonomic-Mousepad-Non-Slip-Computer/dp/B07XC6RHR2/ref=sr_1_765?dchild=1&keywords=mouse&qid=1594378041&s=computers-intl-ship&sr=1-765,4.9 out of 5 stars,27,$12.49,Mouse
660,Logitech Play Collection M325c Mouse - Optical - Wireless - Radio Frequency - USB - 1000 Dpi - Tilt Wheel - 5 Button[s] - Waterm,https://www.amazon.com/Logitech-Collection-Wireless-Optical-Watermelon/dp/B01FM3FBS0/ref=sr_1_768?dchild=1&keywords=mouse&qid=1594378041&s=computers-intl-ship&sr=1-768,4.6 out of 5 stars,179,$25.49,Mouse
661,Cougar gaming CGR-XXNB-MB1 Cougar Bunker Gaming Mouse Bungee,https://www.amazon.com/Cougar-gaming-CGR-XXNB-MB1-Bunker-Gaming/dp/B01HU44Q7G/ref=sr_1_770?dchild=1&keywords=mouse&qid=1594378041&s=computers-intl-ship&sr=1-770,4.7 out of 5 stars,449,$19.89,Mouse
662,Smooffly Mouse pad Unique Design Mouse Pad Cool Blue Dragon Design Gaming Mousepad,https://www.amazon.com/Smooffly-Unique-Design-Dragon-Mousepad/dp/B07C7SZQ66/ref=sr_1_771?dchild=1&keywords=mouse&qid=1594378041&s=computers-intl-ship&sr=1-771,4.3 out of 5 stars,31,$7.89,Mouse
663,"HAVIT Mechanical Keyboard Mouse Headset Kit, Blue Switch Keyboards,Gaming Mouse & RGB Headphones for Laptop Computer PC Games",https://www.amazon.com/Mechanical-Keyboard-Keyboards-Headphones-Computer/dp/B07WC141LZ/ref=sr_1_772?dchild=1&keywords=mouse&qid=1594378041&s=computers-intl-ship&sr=1-772,4.2 out of 5 stars,265,$76.99,Mouse
664,"Computer Wireless Mouse, 2.4G Portable Mobile Optical Office Mouse with USB Receiver, 3 Adjustable DPI Levels, 4 Buttons for Notebook, PC, Laptop, Computer, MacBook (Black)",https://www.amazon.com/gp/slredirect/picassoRedirect.html/ref=pa_sp_atf_next_computers-intl-ship_sr_pg49_1?ie=UTF8&adId=A02113852RFBTC8FJZWNW&url=%2Fdp%2FB088PJJY11%2Fref%3Dsr_1_770_sspa%3Fdchild%3D1%26keywords%3Dmouse%26qid%3D1594378041%26s%3Dcomputers-intl-ship%26sr%3D1-770-spons%26psc%3D1&qualifier=1594462012&id=4427430544511205&widgetName=sp_atf_next,,,$9.99,Mouse
665,Logitech M317 Wireless Mouse - USA,https://www.amazon.com/Logitech-M317-USA-Flag-Mouse/dp/B00I3LQE12/ref=sr_1_771?dchild=1&keywords=mouse&qid=1594378041&s=computers-intl-ship&sr=1-771,4.4 out of 5 stars,73,,Mouse
666,"Wireless Keyboard and Mouse, Jelly Comb 2.4G Ultra Slim Quiet Small Keyboard Mouse Combo for PC, Desktop, Notebook, Laptop, Tablet, Windows XP/7/8/10, Vista - White and Mint Green",https://www.amazon.com/Wireless-Keyboard-Jelly-Comb-Notebook/dp/B0827V3QB6/ref=sr_1_772?dchild=1&keywords=mouse&qid=1594378041&s=computers-intl-ship&sr=1-772,4.7 out of 5 stars,75,$27.99,Mouse
667,"VicTsing Silent Wireless Mouse, Computer Mouse 2.4G with USB Nano Receiver, Little Elegant Mouse with Quiet Mice Clicks 5 Adjustable DPI for Notebook, PC, Laptop, iPad, Computer, MacBook - Gray",https://www.amazon.com/VicTsing-Wireless-Computer-Receiver-Adjustable/dp/B08BYCR9DC/ref=sr_1_773?dchild=1&keywords=mouse&qid=1594378041&s=computers-intl-ship&sr=1-773,,,$19.99,Mouse
