,name,product_url,rating,review_count,price,product_type
0,"Computer Wireless Mouse, WISFOX Wireless Ergonomic Mouse 2.4G Portable Mobile Mouse Optical Mice with Nano Receiver, 3 Adjustable DPI Levels, 6 Buttons for Laptop, Notebook, PC (Grey)",https://www.amazon.com/gp/slredirect/picassoRedirect.html/ref=pa_sp_atf_computers-intl-ship_sr_pg1_1?ie=UTF8&adId=A03739161QOCPU0RHUN8J&url=%2Final%25C3%25A1mbrico-ordenador-ergon%25C3%25B3mico-port%25C3%25A1til-ajustables%2Fdp%2FB07Y1KKFBH%2Fref%3Dsr_1_1_sspa%3Fdchild%3D1%26keywords%3Dmouse%26qid%3D1594461956%26s%3Dcomputers-intl-ship%26sr%3D1-1-spons%26psc%3D1&qualifier=1594461955&id=5941672971974881&widgetName=sp_atf,4.6 out of 5 stars,614,$12.99,Mouse
1,Wireless Mouse 2.4G Jelly Comb Computer Mouse for Laptop with Adjustable DPI 1000/1600/2400 Level Mouse Wireless with PC/Desktop/Windows/MAC OS of Mac Mouse-Black and Sliver,https://www.amazon.com/gp/slredirect/picassoRedirect.html/ref=pa_sp_atf_computers-intl-ship_sr_pg1_1?ie=UTF8&adId=A0151637YF1VARPQEC9H&url=%2FWireless-Jelly-Comb-Adjustable-Receiver%2Fdp%2FB07Y65DF83%2Fref%3Dsr_1_2_sspa%3Fdchild%3D1%26keywords%3Dmouse%26qid%3D1594461956%26s%3Dcomputers-intl-ship%26sr%3D1-2-spons%26psc%3D1&qualifier=1594461955&id=5941672971974881&widgetName=sp_atf,4.4 out of 5 stars,482,$9.99,Mouse
2,"Logitech M510 Wireless Computer Mouse – Comfortable Shape with USB Unifying Receiver, with Back/Forward Buttons and Side-to-Side Scrolling, Dark Gray",https://www.amazon.com/Logitech-Wireless-Computer-Mouse-Side/dp/B003NR57BY/ref=sr_1_3?dchild=1&keywords=mouse&qid=1594461956&s=computers-intl-ship&sr=1-3,4.5 out of 5 stars,"20,831",,Mouse
3,"Logitech B100 Corded Mouse – Wired USB Mouse for Computers and laptops, for Right or Left Hand Use, Black",https://www.amazon.com/Logitech-800dpi-Optical-3-button-Ambidextrous/dp/B003L62T7W/ref=sr_1_4?dchild=1&keywords=mouse&qid=1594461956&s=computers-intl-ship&sr=1-4,4.5 out of 5 stars,"6,506",,Mouse
4,"Logitech M525 Wireless Mouse – Long 3 Year Battery Life, Ergonomic Shape for Right or Left Hand Use, Micro-Precision Scroll Wheel, and USB Unifying Receiver for Computers and Laptops, Black/Gray",https://www.amazon.com/Logitech-M525-Wireless-Mouse-Micro-Precision/dp/B005KSAHZU/ref=sr_1_5?dchild=1&keywords=mouse&qid=1594461956&s=computers-intl-ship&sr=1-5,4.6 out of 5 stars,"4,677",,Mouse
5,Verbatim Optical Mouse - Wired with USB Accessibility - Mac & PC Compatible - Black,https://www.amazon.com/Verbatim-Optical-Mouse-Accessibility-Compatible/dp/B00LPC3O3M/ref=sr_1_6?dchild=1&keywords=mouse&qid=1594461956&s=computers-intl-ship&sr=1-6,4.3 out of 5 stars,846,$4.99,Mouse
6,"Wireless Mouse, RATEL 2.4G Wireless Ergonomic Mouse Computer Mouse Laptop Mouse USB Mouse 6 Buttons with Nano Receiver 3 Adjustable DPI Levels Cordless Wireless Mice for Windows, Mac (Black+Grey)",https://www.amazon.com/Wireless-RATEL-Ergonomic-Computer-Adjustable/dp/B07SCY7H3W/ref=sr_1_7?dchild=1&keywords=mouse&qid=1594461956&s=computers-intl-ship&sr=1-7,4.5 out of 5 stars,960,$18.99,Mouse
7,AmazonBasics Wireless Computer Mouse with USB Nano Receiver - Black,https://www.amazon.com/AmazonBasics-Wireless-Computer-Mouse-Receiver/dp/B005EJH6Z4/ref=sr_1_9?dchild=1&keywords=mouse&qid=1594461956&s=computers-intl-ship&sr=1-9,4.3 out of 5 stars,"20,286",$12.99,Mouse
8,"AmazonBasics 3-Button USB Wired Computer Mouse (Black), 1-Pack",https://www.amazon.com/AmazonBasics-3-Button-Wired-Computer-1-Pack/dp/B005EJH6RW/ref=sr_1_10?dchild=1&keywords=mouse&qid=1594461956&s=computers-intl-ship&sr=1-10,4.5 out of 5 stars,"20,843",$7.65,Mouse
9,"Multifunctional Wireless Mouse, Cimetech 2.4G Cordless Mouse for Laptop with USB Receiver Comfortable Click Computer Mice, 6 Buttons Optical Mouse (White)",https://www.amazon.com/gp/slredirect/picassoRedirect.html/ref=pa_sp_mtf_computers-intl-ship_sr_pg1_1?ie=UTF8&adId=A0362074S7T3NREGTI8E&url=%2FMultifunctional-Wireless-Cimetech-Cordless-Comfortable%2Fdp%2FB089NGJM8X%2Fref%3Dsr_1_11_sspa%3Fdchild%3D1%26keywords%3Dmouse%26qid%3D1594461956%26s%3Dcomputers-intl-ship%26sr%3D1-11-spons%26psc%3D1&qualifier=1594461955&id=5941672971974881&widgetName=sp_mtf,4.2 out of 5 stars,167,$6.99,Mouse
10,"WisFox Computer Wireless Mouse, 2.4G Wireless Ergonomic Mouse Portable Cordless Optical Mice for Laptop PC with USB Receiver, 3 Adjustable DPI Levels, 6 Buttons for Work, Study, Home, Travel (Grey)",https://www.amazon.com/gp/slredirect/picassoRedirect.html/ref=pa_sp_mtf_computers-intl-ship_sr_pg1_1?ie=UTF8&adId=A08306032CAVLSZK4R9LE&url=%2FWisFox-Computer-Wireless-Ergonomic-Adjustable%2Fdp%2FB087LQVH4Y%2Fref%3Dsr_1_12_sspa%3Fdchild%3D1%26keywords%3Dmouse%26qid%3D1594461956%26s%3Dcomputers-intl-ship%26sr%3D1-12-spons%26psc%3D1&qualifier=1594461955&id=5941672971974881&widgetName=sp_mtf,4.5 out of 5 stars,372,$14.99,Mouse
11,Redragon M602 RGB Wired Gaming Mouse RGB Spectrum Backlit Ergonomic Mouse Griffin Programmable with 7 backlight modes up to 7200 DPI for Windows PC Gamers (Black),https://www.amazon.com/Redragon-M602-Ergonomic-High-Precision-Programmable/dp/B011HMDZ0Q/ref=sr_1_13?dchild=1&keywords=mouse&qid=1594461956&s=computers-intl-ship&sr=1-13,4.6 out of 5 stars,"3,187",$29.99,Mouse
12,Razer DeathAdder Essential Gaming Mouse: 6400 DPI Optical Sensor - 5 Programmable Buttons - Mechanical Switches - Rubber Side Grips - White,https://www.amazon.com/Razer-DeathAdder-Essential-Gaming-Mouse/dp/B07Y693ND1/ref=sr_1_14?dchild=1&keywords=mouse&qid=1594461956&s=computers-intl-ship&sr=1-14,4.5 out of 5 stars,"9,599",$29.99,Mouse
13,"Logitech M570 Wireless Trackball Mouse – Ergonomic Design with Sculpted Right-Hand Shape, Compatible with Apple Mac and Microsoft Windows Computers, USB Unifying Receiver, Dark Gray",https://www.amazon.com/Logitech-M570-Wireless-Trackball-Mouse/dp/B0043T7FXE/ref=sr_1_15?dchild=1&keywords=mouse&qid=1594461956&s=computers-intl-ship&sr=1-15,4.5 out of 5 stars,"22,000",,Mouse
14,Logitech Wireless Mouse M185 (Swift Grey),https://www.amazon.com/Logitech-M185-Swift-Wireless-Mouse/dp/B00O3TIZXS/ref=sr_1_16?dchild=1&keywords=mouse&qid=1594461956&s=computers-intl-ship&sr=1-16,4.5 out of 5 stars,736,,Mouse
15,"Logitech M330 Silent Plus Wireless Mouse – Enjoy Same Click Feel with 90% Less Click Noise, 2 Year Battery Life, Ergonomic Right-Hand Shape for Computers and Laptops, USB Unifying Receiver, Black",https://www.amazon.com/Logitech-M330-Silent-Wireless-Mouse/dp/B01JPOLKDW/ref=sr_1_17?dchild=1&keywords=mouse&qid=1594461956&s=computers-intl-ship&sr=1-17,4.6 out of 5 stars,"2,964",,Mouse
16,"Wireless Computer Mouse, Cimetech 2.4G Slim Cordless Mouse Less Noise for Laptop Ergonomic Optical with Nano Receiver USB Mouse for Laptop, Deskbtop, MacBook (BAT Black)",https://www.amazon.com/Wireless-Computer-Cimetech-Cordless-Ergonomic/dp/B07T8HFPDM/ref=sr_1_18?dchild=1&keywords=mouse&qid=1594461956&s=computers-intl-ship&sr=1-18,4.3 out of 5 stars,"2,034",$9.99,Mouse
17,"Logitech M535 Bluetooth Mouse Compact Wireless Mouse with 10 Month Battery Life Works with Any Bluetooth Enabled Computer, Laptop or Tablet Running Windows, Mac OS, Chrome or Android, Gray - Black",https://www.amazon.com/Logitech-M535-Bluetooth-Mouse-Wireless/dp/B0148NPIQK/ref=sr_1_19?dchild=1&keywords=mouse&qid=1594461956&s=computers-intl-ship&sr=1-19,4.4 out of 5 stars,"3,385",$29.94,Mouse
18,"Coolerplus FC112 USB Optical Wired Computer Mouse with Easy Click for Office and Home, 1000DPI, Premium and Portable,Compatible with Windows PC, Laptop, Desktop, Notebook",https://www.amazon.com/Coolerplus-Optical-Computer-Portable-Compatible/dp/B07QV91YWT/ref=sr_1_20?dchild=1&keywords=mouse&qid=1594461956&s=computers-intl-ship&sr=1-20,4.5 out of 5 stars,706,$10.99,Mouse
19,"2.4GHz Wireless Bluetooth Mouse, 3 Adjustable DPI, Dual Mode Slim Rechargeable Wireless Mouse Silent USB Mice,Compatible for Laptop Windows Mac Android MAC PC Computer (Rose Gold)",https://www.amazon.com/gp/slredirect/picassoRedirect.html/ref=pa_sp_btf_computers-intl-ship_sr_pg1_1?ie=UTF8&adId=A0619741FKZFAXBH44N3&url=%2FWireless-Bluetooth-Adjustable-Rechargeable-Compatible%2Fdp%2FB07WS74Z67%2Fref%3Dsr_1_21_sspa%3Fdchild%3D1%26keywords%3Dmouse%26qid%3D1594461956%26s%3Dcomputers-intl-ship%26sr%3D1-21-spons%26psc%3D1&qualifier=1594461955&id=5941672971974881&widgetName=sp_btf,4.0 out of 5 stars,185,$15.99,Mouse
20,"2.4G Wireless Mouse Portable Mobile Optical Mouse with USB Receiver, 5 Adjustable DPI Levels, 6 Buttons for Notebook, PC, Laptop, Computer, MacBook G",https://www.amazon.com/gp/slredirect/picassoRedirect.html/ref=pa_sp_btf_computers-intl-ship_sr_pg1_1?ie=UTF8&adId=A08447933AL0A9UD2P6XI&url=%2FWireless-Portable-Receiver-Adjustable-Notebook%2Fdp%2FB083GSH1QY%2Fref%3Dsr_1_22_sspa%3Fdchild%3D1%26keywords%3Dmouse%26qid%3D1594461956%26s%3Dcomputers-intl-ship%26sr%3D1-22-spons%26psc%3D1&qualifier=1594461955&id=5941672971974881&widgetName=sp_btf,4.0 out of 5 stars,24,$12.99,Mouse
21,"BENGOO Gaming Mouse Wired, USB Ergonomic Computer Mice with Chroma RGB Backlit, 6400 DPI Adjustable, 6 Programmable Buttons, Optical Laptop PC Gamer Gaming Mice with Weight Tuning",https://www.amazon.com/gp/slredirect/picassoRedirect.html/ref=pa_sp_atf_next_computers-intl-ship_sr_pg2_1?ie=UTF8&adId=A07876161KG2ZCYF02SDV&url=%2FErgonomic-Computer-Backlit-Adjustable-Programmable%2Fdp%2FB07SW48NDK%2Fref%3Dsr_1_17_sspa%3Fdchild%3D1%26keywords%3Dmouse%26qid%3D1594378041%26s%3Dcomputers-intl-ship%26sr%3D1-17-spons%26psc%3D1&qualifier=1594461957&id=3150168804250686&widgetName=sp_atf_next,4.4 out of 5 stars,74,$16.99,Mouse
22,"Ultra-Thin 2.4G Office Wireless Mouse Mute Charging Mouse Notebook Home Mouse with USB Receiver Compatible for Notebook, PC, Laptop, Computer, MacBook (Rose Gold)",https://www.amazon.com/gp/slredirect/picassoRedirect.html/ref=pa_sp_atf_next_computers-intl-ship_sr_pg2_1?ie=UTF8&adId=A08078172U00XRYI81JSS&url=%2FUltra-Thin-Wireless-Charging-Notebook-Compatible%2Fdp%2FB07VVQT5YC%2Fref%3Dsr_1_18_sspa%3Fdchild%3D1%26keywords%3Dmouse%26qid%3D1594378041%26s%3Dcomputers-intl-ship%26sr%3D1-18-spons%26psc%3D1&qualifier=1594461957&id=3150168804250686&widgetName=sp_atf_next,4.1 out of 5 stars,275,$12.99,Mouse
23,"Logitech MX Master Wireless Mouse – High-Precision Sensor, Speed-Adaptive Scroll Wheel, Easy-Switch up to 3 Devices - Meteorite Black",https://www.amazon.com/Logitech-Master-Wireless-Mouse-High-Precision/dp/B07DHDFW5V/ref=sr_1_19?dchild=1&keywords=mouse&qid=1594378041&s=computers-intl-ship&sr=1-19,4.5 out of 5 stars,"1,295",,Mouse
24,"Wireless Mouse, 2.4G Slim Window Laptop Wireless Mice, with USB Receiver and Type-C Adapter, 1600DPI Silent Click Cordless Computer Mouse for PC/Laptop/Mac/Desktop(Matte Black)",https://www.amazon.com/Wireless-Receiver-Adapter-Cordless-Computer/dp/B084RQ6SJL/ref=sr_1_21?dchild=1&keywords=mouse&qid=1594378041&s=computers-intl-ship&sr=1-21,4.8 out of 5 stars,428,$9.99,Mouse
25,"Razer Mamba Wireless Gaming Mouse: 16,000 DPI Optical Sensor - Chroma RGB Lighting - 7 Programmable Buttons - Mechanical Switches - Up to 50 Hr Battery Life",https://www.amazon.com/Razer-Mamba-Wireless-Programmable-Gaming/dp/B07GBYYSMF/ref=sr_1_22?dchild=1&keywords=mouse&qid=1594378041&s=computers-intl-ship&sr=1-22,4.4 out of 5 stars,"2,090",$45.06,Mouse
26,"VicTsing Wireless Mouse Rechargeable, Big Size Comfortable Ergonomic Mouse -Fits Nicely to Your Right Hand, Silent Click /5 Adjustable DPI /6 Button, Computer Mouse for Laptop PC MacBook Desktop",https://www.amazon.com/VicTsing-Rechargeable-Comfortable-Ergonomic-Adjustable/dp/B085VMXG47/ref=sr_1_23?dchild=1&keywords=mouse&qid=1594378041&s=computers-intl-ship&sr=1-23,4.5 out of 5 stars,354,$17.00,Mouse
27,"seenda Wireless Mouse, 2.4G Noiseless Mouse with USB Receiver Portable Computer Mice for PC, Tablet, Laptop with Windows System (Light Blue)",https://www.amazon.com/seenda-Wireless-Noiseless-Receiver-Portable/dp/B07TSS52FZ/ref=sr_1_24?dchild=1&keywords=mouse&qid=1594378041&s=computers-intl-ship&sr=1-24,4.6 out of 5 stars,"9,490",$12.99,Mouse
28,"Belkin WaveRest Gel Mouse Pad, Black (F8E262-BLK)",https://www.amazon.com/Belkin-WaveRest-Mouse-Black-F8E262-BLK/dp/B00000JRRD/ref=sr_1_25?dchild=1&keywords=mouse&qid=1594378041&s=computers-intl-ship&sr=1-25,4.3 out of 5 stars,"10,517",$8.00,Mouse
29,"AI DAMI Wireless Mouse Rechargeable, Wireless Mouse for Laptop Mac Computer Desktop Notebook PC，Wireless Mouse (Silver)",https://www.amazon.com/AI-Wireless-Rechargeable-Computer-PC%EF%BC%8CWireless/dp/B088CYZHGX/ref=sr_1_26?dchild=1&keywords=mouse&qid=1594378041&s=computers-intl-ship&sr=1-26,4.6 out of 5 stars,46,$11.96,Mouse
30,"BENGOO Gaming Mouse Wired, USB Optical Computer Mice with RGB Backlit, 4 Adjustable DPI Up to 3600, Ergonomic Gamer Laptop PC Mouse with 6 Programmable Buttons for Windows 7/8/10/XP Vista Linux -Black",https://www.amazon.com/gp/slredirect/picassoRedirect.html/ref=pa_sp_mtf_computers-intl-ship_sr_pg2_1?ie=UTF8&adId=A05277361ZTSYCKFDV41O&url=%2FBENGOO-Changing-Ergonomic-Computer-Adjustable%2Fdp%2FB00Z9V0NKC%2Fref%3Dsr_1_28_sspa%3Fdchild%3D1%26keywords%3Dmouse%26qid%3D1594378041%26s%3Dcomputers-intl-ship%26sr%3D1-28-spons%26psc%3D1&qualifier=1594461957&id=3150168804250686&widgetName=sp_mtf,4.6 out of 5 stars,535,$12.99,Mouse
31,"Anker 2.4G Wireless Vertical Ergonomic Optical Mouse, 800 / 1200 /1600 DPI, 5 Buttons for Laptop, Desktop, PC, Macbook - Black",https://www.amazon.com/Anker-Wireless-Vertical-Ergonomic-Optical/dp/B00BIFNTMC/ref=sr_1_29?dchild=1&keywords=mouse&qid=1594378041&s=computers-intl-ship&sr=1-29,4.1 out of 5 stars,"17,354",$25.99,Mouse
32,AmazonBasics Compact Ergonomic Wireless PC Mouse with Fast Scrolling - Silver,https://www.amazon.com/AmazonBasics-Compact-Ergonomic-Wireless-Scrolling/dp/B0787PGF9R/ref=sr_1_30?dchild=1&keywords=mouse&qid=1594378041&s=computers-intl-ship&sr=1-30,4.3 out of 5 stars,"1,568",$18.93,Mouse
33,"3M Precise Mouse Pad Enhances the Precision of Optical Mice at Fast Speeds and Extends the Battery Life of Wireless Mice up to 50%, 9 in x 8 in (MP114-BSD1)",https://www.amazon.com/3M-Enhances-Precision-Wireless-MP114-BSD1/dp/B00L2AN9PK/ref=sr_1_32?dchild=1&keywords=mouse&qid=1594378041&s=computers-intl-ship&sr=1-32,4.5 out of 5 stars,"3,449",$7.25,Mouse
34,"VicTsing mm057 2.4G Wireless Portable Mobile Mouse Optical Mice with USB Receiver, 5 Adjustable DPI Levels, 6 Buttons for Notebook, PC, Laptop, Computer, MacBook-Red",https://www.amazon.com/VicTsing-Wireless-Portable-Adjustable-MacBook-Red/dp/B07Y1L2QD3/ref=sr_1_33?dchild=1&keywords=mouse&qid=1594378041&s=computers-intl-ship&sr=1-33,4.5 out of 5 stars,"46,988",$16.85,Mouse
35,"Razer Naga Trinity Gaming Mouse: 16,000 DPI Optical Sensor - Chroma RGB Lighting - Interchangeable Side Plate w/ 2, 7, 12 Button Configurations - Mechanical Switches",https://www.amazon.com/Razer-Naga-Trinity-Optical-Interchangeable/dp/B0788MCRGC/ref=sr_1_34?dchild=1&keywords=mouse&qid=1594378041&s=computers-intl-ship&sr=1-34,4.1 out of 5 stars,"2,435",$74.00,Mouse
36,V7 Black Mouse Pad - MP01BLK-2NP,https://www.amazon.com/V7-Black-Mouse-Pad-MP01BLK-2NP/dp/B00BIZ8GHA/ref=sr_1_35?dchild=1&keywords=mouse&qid=1594378041&s=computers-intl-ship&sr=1-35,4.2 out of 5 stars,913,$1.99,Mouse
37,Microsoft Arc Mouse (ELG-00001) Black,https://www.amazon.com/Microsoft-Arc-Mouse-ELG-00001-Black/dp/B072FG8LBV/ref=sr_1_36?dchild=1&keywords=mouse&qid=1594378041&s=computers-intl-ship&sr=1-36,4.5 out of 5 stars,"3,191",$59.29,Mouse
38,"Vertical Wireless Mouse, Jelly Comb Ergonomic Mouse Reduces Wrist Strain, Easy Switch Between 3 Computers with Bluetooth, USB or Type C Connection, Rechargeable - MV09D",https://www.amazon.com/gp/slredirect/picassoRedirect.html/ref=pa_sp_btf_computers-intl-ship_sr_pg2_1?ie=UTF8&adId=A06870521Z2TUFRIK9DAK&url=%2FJelly-Comb-Ergonomic-Connection-Rechargeable%2Fdp%2FB07VJYPVPW%2Fref%3Dsr_1_38_sspa%3Fdchild%3D1%26keywords%3Dmouse%26qid%3D1594378041%26s%3Dcomputers-intl-ship%26sr%3D1-38-spons%26psc%3D1%26smid%3DA30CLHMTEZUEN2&qualifier=1594461957&id=3150168804250686&widgetName=sp_btf,4.4 out of 5 stars,146,$30.99,Mouse
39,"Logitech MX Anywhere 2S Wireless Mouse – Use On Any Surface, Hyper-Fast Scrolling, Rechargeable, Control Up to 3 Apple Mac and Windows Computers and Laptops (Bluetooth or USB), Graphite",https://www.amazon.com/Logitech-MX-Anywhere-inal%C3%A1mbrico-compartido/dp/B071VK5KXN/ref=sr_1_35?dchild=1&keywords=mouse&qid=1594378041&s=computers-intl-ship&sr=1-35,4.4 out of 5 stars,"3,310",$59.38,Mouse
40,AmazonBasics Gel Computer Mouse Pad with Wrist Support Rest,https://www.amazon.com/AmazonBasics-Gel-Mouse-Wrist-Rest/dp/B06X3W3TM4/ref=sr_1_36?dchild=1&keywords=mouse&qid=1594378041&s=computers-intl-ship&sr=1-36,4.5 out of 5 stars,"4,053",$9.07,Mouse
41,"ITNRSIIET Mouse Pad, Orange Flowers Pattern Design Mousepad. Customized Gaming Mousepads for Laptop and Computer. Cute Design Desk Accessories. Non-Slip, Stitched Edges, Waterproof",https://www.amazon.com/ITNRSIIET-Alfombrilla-alfombrilla-antideslizante-ordenador/dp/B083RY1YYN/ref=sr_1_37?dchild=1&keywords=mouse&qid=1594378041&s=computers-intl-ship&sr=1-37,4.8 out of 5 stars,185,$6.98,Mouse
42,"FLAGPOWER Gaming Keyboard and Mouse Combo, Rainbow Backlit Mechanical Feeling Keyboard with 4 Colors Breathing LED Backlight Mouse for PC Laptop Computer Game and Work",https://www.amazon.com/FLAGPOWER-Mechanical-Multimedia-Breathing-Backlight/dp/B07432V11H/ref=sr_1_39?dchild=1&keywords=mouse&qid=1594378041&s=computers-intl-ship&sr=1-39,4.3 out of 5 stars,934,$28.99,Mouse
43,"Ergonomic Mouse Pad with Wrist Rest Support, Black | Eliminates All Pains, Carpal Tunnel & Any Other Wrist Discomfort! Non-Slip Base, Stitched Edges! (1)",https://www.amazon.com/dp/B01LTGX776/ref=sr_1_40?dchild=1&keywords=mouse&qid=1594378041&s=computers-intl-ship&sr=1-40,4.6 out of 5 stars,"1,106",$9.97,Mouse
44,"ITNRSIIET Ergonomic Mouse Pad with Gel Wrist Rest Support, Stay Positive Work Hard and Make It Happen Arrow Print Inspirational Quote Mouse Pad, Pain Relief Wrist Rest Pad with Non-Slip PU Base",https://www.amazon.com/ITNRSIIET-Ergonomic-Positive-Inspirational-Non-Slip/dp/B07WZYKYZC/ref=sr_1_41?dchild=1&keywords=mouse&qid=1594378041&s=computers-intl-ship&sr=1-41,4.7 out of 5 stars,394,$9.48,Mouse
45,"Wireless Mouse, seenda 2.4G Wireless Computer Mouse with Nano Receiver 3 Adjustable DPI Levels, Portable Mobile Optical Mice for Laptop, PC, Chromebook, Computer, Notebook, Pink & Blue",https://www.amazon.com/inal%C3%A1mbrico-ordenador-ajustables-port%C3%A1tiles-Chromebook/dp/B07X7TKDV2/ref=sr_1_42?dchild=1&keywords=mouse&qid=1594378041&s=computers-intl-ship&sr=1-42,4.4 out of 5 stars,467,$10.99,Mouse
46,"Blade Hawks RGB Gaming Mouse Pad, LED Soft Extra Extended Large Mouse Pad, Anti-Slip Rubber Base, Computer Keyboard Mouse Mat - 31.5 X 12 Inch",https://www.amazon.com/Blade-Hawks-Alfombrilla-videojuegos-antideslizante/dp/B07L4BGL3D/ref=sr_1_45?dchild=1&keywords=mouse&qid=1594378041&s=computers-intl-ship&sr=1-45,4.8 out of 5 stars,"1,752",$24.99,Mouse
47,Logitech G502 HERO High Performance Gaming Mouse,https://www.amazon.com/Logitech-G502-Performance-Gaming-Mouse/dp/B07GBZ4Q68/ref=sr_1_46?dchild=1&keywords=mouse&qid=1594378041&s=computers-intl-ship&sr=1-46,4.3 out of 5 stars,"3,997",,Mouse
48,"Logitech Pebble M350 Wireless Mouse with Bluetooth or USB - Silent, Slim Computer Mouse with Quiet Click for iPad, Laptop, Notebook, PC and Mac - Pink Rose",https://www.amazon.com/Logitech-Pebble-Wireless-Mouse-Bluetooth/dp/B07X5GHZYJ/ref=sr_1_47?dchild=1&keywords=mouse&qid=1594378041&s=computers-intl-ship&sr=1-47,4.7 out of 5 stars,594,$26.42,Mouse
49,"MROCO Computer Mouse Pad [30% Larger] with Non-Slip Rubber Base, Premium-Textured & Waterproof Mousepad with Stitched Edges, Mouse Pads for Computers, Laptop, Gaming, Office & Home, 8.5 x 11 in, Black",https://www.amazon.com/MROCO-Comfortable-Mouse-Non-Slip-Waterproof/dp/B07B7LBPNZ/ref=sr_1_48?dchild=1&keywords=mouse&qid=1594378041&s=computers-intl-ship&sr=1-48,4.7 out of 5 stars,"1,626",$5.49,Mouse
50,"Rechargeable Wireless Mouse,3 Adjustable DPI ，Less Noise,2.4G Slim Silent Click Wireless Optical Mice, Portable Mobile Wireless Mouse for Notebook, PC, Laptop, Computer, (Silver)",https://www.amazon.com/Rechargeable-Wireless-Adjustable-Portable-Notebook/dp/B07VK78MC5/ref=sr_1_49?dchild=1&keywords=mouse&qid=1594378041&s=computers-intl-ship&sr=1-49,4.0 out of 5 stars,140,$11.99,Mouse
51,"Bluetooth Mouse, Jelly Comb MS003 Slim Dual Mode(Bluetooth 4.0 + USB) 2.4GHz Wireless Bluetooth Mouse for Laptop, iPad, MacBook, PC- For Windows 8.0/ MacOS 10.10/ iPad OS 13/ Android 4.3 or Above",https://www.amazon.com/Bluetooth-Jelly-Comb-Wireless-MacBook/dp/B07N1CMC4P/ref=sr_1_51?dchild=1&keywords=mouse&qid=1594378041&s=computers-intl-ship&sr=1-51,4.5 out of 5 stars,982,$15.99,Mouse
52,"Logitech MK270 Wireless Keyboard and Mouse Combo — Keyboard and Mouse Included, 2.4GHz Dropout-Free Connection, Long Battery Life, Mouse and Keyboard, Standard Packaging",https://www.amazon.com/Logitech-MK270-Wireless-Keyboard-Mouse/dp/B00BP5KOPA/ref=sr_1_52?dchild=1&keywords=mouse&qid=1594378041&s=computers-intl-ship&sr=1-52,4.2 out of 5 stars,"22,386",,Mouse
53,"Smooffly Funny Quote Mouse Pad,A Wise Woman Once Said and she Lived Happily Ever After Computer Mouse Pad 9.5 X 7.9 Inch (240mmX200mmX3mm)",https://www.amazon.com/Smooffly-Funny-Happily-Computer-240mmX200mmX3mm/dp/B07TLYLC5M/ref=sr_1_51?dchild=1&keywords=mouse&qid=1594378041&s=computers-intl-ship&sr=1-51,4.9 out of 5 stars,262,$7.89,Mouse
54,Razer Viper Mini Ultralight Gaming Mouse: Fastest Gaming Switches - 8500 DPI Optical Sensor - Chroma RGB Underglow Lighting - 6 Programmable Buttons - Drag-Free Cord - Classic Black,https://www.amazon.com/Razer-Viper-Ultralight-Gaming-Mouse/dp/B084RPZD6T/ref=sr_1_52?dchild=1&keywords=mouse&qid=1594378041&s=computers-intl-ship&sr=1-52,4.5 out of 5 stars,"1,541",$39.99,Mouse
55,"ABKONCORE M30 Gaming Mouse Wired, USB Computer Mice for Game & Daily, 8 Programmable Buttons, Chroma RGB Backlit, 3500 DPI Adjustable, Comfortable Grip Ergonomic Mice for PC, Laptop, Mac, Windows",https://www.amazon.com/ABKONCORE-Computer-Programmable-Adjustable-Comfortable/dp/B07VRB9CTD/ref=sr_1_53?dchild=1&keywords=mouse&qid=1594378041&s=computers-intl-ship&sr=1-53,4.6 out of 5 stars,119,$17.99,Mouse
56,"VicTsing Wireless Mouse for Laptop, Silent Click & Comfortable Hand Feelings, 12 Months Battery Life, Computer USB Mouse with Nano Receiver, Compatible with Laptop, PC, Computer, Notebook, Mac - Pink",https://www.amazon.com/dp/B07ZKCC3Y6/ref=sr_1_54?dchild=1&keywords=mouse&qid=1594378041&s=computers-intl-ship&sr=1-54,4.4 out of 5 stars,"7,053",$15.00,Mouse
57,"Memzuoix 2.4G Wireless Mouse, Portable Mobile Optical Mouse with USB Receiver, 1,000 DPI Ergonomic Cordless Mouse for Laptop, Computer, Mac, PC, 5 Buttons, Red",https://www.amazon.com/Memzuoix-Wireless-Portable-Receiver-Ergonomic/dp/B07WCW1PB3/ref=sr_1_55?dchild=1&keywords=mouse&qid=1594378041&s=computers-intl-ship&sr=1-55,4.4 out of 5 stars,280,$16.79,Mouse
58,"Nulaxy 2.4G Wireless Vertical Ergonomic Mouse, 800 / 1200 /1600 DPI, 6 Buttons for Computer, Laptop, PC, Desktop, Macbook - Black",https://www.amazon.com/Nulaxy-Wireless-Vertical-Ergonomic-Computer/dp/B07H184VD4/ref=sr_1_56?dchild=1&keywords=mouse&qid=1594378041&s=computers-intl-ship&sr=1-56,4.3 out of 5 stars,893,$13.99,Mouse
59,Microsoft Wireless Mobile Mouse 4000 - Graphite (D5D-00001),https://www.amazon.com/Microsoft-Wireless-Mobile-Mouse-4000/dp/B002DPUUL4/ref=sr_1_57?dchild=1&keywords=mouse&qid=1594378041&s=computers-intl-ship&sr=1-57,4.3 out of 5 stars,"4,732",,Mouse
60,"RGB Gaming Mouse Pad, UtechSmart Large Extended Soft Led Mouse Pad with 14 Lighting Modes 2 Brightness Levels, Computer Keyboard Mousepads Mat 800 x 300mm / 31.5×11.8 inches",https://www.amazon.com/UtechSmart-Alfombrilla-videojuegos-iluminaci%C3%B3n-11-811/dp/B07PQDLF51/ref=sr_1_58?dchild=1&keywords=mouse&qid=1594378041&s=computers-intl-ship&sr=1-58,4.8 out of 5 stars,"1,514",$23.99,Mouse
61,"YUMQUA G189 USB Wired Mouse, Office & Home Optical Ergonomic Computer Mouse with 4 Adjustable DPI (Up to 1600) for PC Laptop Mac - Black",https://www.amazon.com/gp/slredirect/picassoRedirect.html/ref=pa_sp_mtf_computers-intl-ship_sr_pg4_1?ie=UTF8&adId=A0494026UK7YEI77OIRM&url=%2FYUMQUA-Ergonomic-Business-Adjustable-Compatible%2Fdp%2FB07DXNLTKR%2Fref%3Dsr_1_59_sspa%3Fdchild%3D1%26keywords%3Dmouse%26qid%3D1594378041%26s%3Dcomputers-intl-ship%26sr%3D1-59-spons%26psc%3D1&qualifier=1594461959&id=8765635875688851&widgetName=sp_mtf,4.2 out of 5 stars,106,$7.98,Mouse
62,"Rechargeable Wireless Mouse,2.4G Slim Silent Click Wireless Optical Mice, 3 Adjustable DPI - Less Noise, Portable Mobile Wireless Mouse for Notebook, PC, Laptop, Computer, MacBook (Silver)",https://www.amazon.com/gp/slredirect/picassoRedirect.html/ref=pa_sp_mtf_computers-intl-ship_sr_pg4_1?ie=UTF8&adId=A06838113JUBH8A44C5ER&url=%2FWireless-Receiver-Portable-Notebook-Computer%2Fdp%2FB07L3SVFXY%2Fref%3Dsr_1_60_sspa%3Fdchild%3D1%26keywords%3Dmouse%26qid%3D1594378041%26s%3Dcomputers-intl-ship%26sr%3D1-60-spons%26psc%3D1&qualifier=1594461959&id=8765635875688851&widgetName=sp_mtf,4.2 out of 5 stars,387,$11.99,Mouse
63,"Ergonomic Wireless Mouse Cool Iron Man Mouse 2.4 G Portable Mobile Computer Click Silent Mouse Optical Mice with USB Receiver, Multi-Color Choosing for Notebook PC Laptop Computer Mac Book (Gold)",https://www.amazon.com/Ergonomic-Wireless-Portable-Computer-Multi-Color/dp/B085XX9XNL/ref=sr_1_62?dchild=1&keywords=mouse&qid=1594378041&s=computers-intl-ship&sr=1-62,4.4 out of 5 stars,46,$16.99,Mouse
64,"Type C Wireless Mouse, Jelly Comb Dual Mode 2.4Ghz Rechargeable Slim Wireless Mouse with Nano USB and Type C Receiver for PC Laptop, MacBook pro, MacBook air, iMac-MS05 (White and Silver)",https://www.amazon.com/Wireless-Jelly-Comb-Rechargeable-iMac-MS05/dp/B07MBM5X7V/ref=sr_1_63?dchild=1&keywords=mouse&qid=1594378041&s=computers-intl-ship&sr=1-63,4.5 out of 5 stars,796,$17.99,Mouse
